show_id,type,title,country,date_added,release_year,rating,listed_in,Date,Open,High,Low,Close,Adj_close,Volume
s5408,TV Show,World at Your Feet,Singapore,7/1/2017,2014,TV-14,"International TV Shows, TV Dramas",,,,,,,
s5409,Movie,Yaar Gaddar,India,7/1/2017,1994,TV-14,"Dramas, International Movies",,,,,,,
s5410,TV Show,Yes We Can!,Singapore,7/1/2017,2014,TV-14,"International TV Shows, TV Dramas",,,,,,,
s5411,TV Show,Yours Fatefully,Singapore,7/1/2017,2012,TV-14,"International TV Shows, Romantic TV Shows, TV Comedies",,,,,,,
s5412,Movie,Zipi & Zape y la Isla del Capitan,Spain,7/1/2017,2016,TV-PG,"Children & Family Movies, Comedies",,,,,,,
s5980,Movie,1 Chance 2 Dance,United States,7/1/2017,2014,TV-PG,"Dramas, Romantic Movies",,,,,,,
s6110,Movie,Albion: The Enchanted Stallion,"United States, Bulgaria",7/1/2017,2016,TV-PG,Children & Family Movies,,,,,,,
s6280,TV Show,Being Mary Jane: The Series,United States,7/1/2017,2016,TV-14,"Romantic TV Shows, TV Dramas",,,,,,,
s6329,Movie,Black Snow,"Argentina, Spain",7/1/2017,2017,TV-MA,"Dramas, International Movies, Thrillers",,,,,,,
s6384,Movie,Bruno and Boots: The Wizzle War,Canada,7/1/2017,2017,TV-PG,"Children & Family Movies, Comedies",,,,,,,
s6457,TV Show,Cheers,United States,7/1/2017,1992,TV-PG,"Classic & Cult TV, TV Comedies",,,,,,,
s6588,TV Show,Deep Water,Australia,7/1/2017,2016,TV-MA,"Crime TV Shows, International TV Shows, TV Dramas",,,,,,,
s6672,TV Show,El Barco,Spain,7/1/2017,2013,NR,"International TV Shows, Romantic TV Shows, Spanish-Language TV Shows",,,,,,,
s6962,Movie,Here Alone,United States,7/1/2017,2016,TV-MA,Horror Movies,,,,,,,
s6981,Movie,Ho Mann Jahaan,Pakistan,7/1/2017,2015,TV-PG,"Dramas, International Movies, Romantic Movies",,,,,,,
s7481,TV Show,Momo Salon,South Korea,7/1/2017,2014,TV-14,"International TV Shows, Korean TV Shows, Romantic TV Shows",,,,,,,
s8190,TV Show,The Andy Griffith Show,United States,7/1/2017,1967,TV-G,"Classic & Cult TV, TV Comedies",,,,,,,
s8542,TV Show,The Twilight Zone (Original Series),United States,7/1/2017,1963,TV-14,"Classic & Cult TV, TV Sci-Fi & Fantasy",,,,,,,
s8590,Movie,Tik Tok,China,7/1/2017,2016,TV-14,"Dramas, International Movies, Thrillers",,,,,,,
s8645,TV Show,Twin Peaks,United States,7/1/2017,1990,TV-14,"Classic & Cult TV, Crime TV Shows, TV Dramas",,,,,,,
s8687,Movie,Waar,Pakistan,7/1/2017,2013,TV-MA,"Action & Adventure, International Movies",,,,,,,
s8762,Movie,Wrong No.,Pakistan,7/1/2017,2015,TV-14,"Comedies, International Movies, Romantic Movies",,,,,,,
s8674,Movie,Vegas Baby,United States,7/4/2017,2016,TV-14,Documentaries,,,,,,,
s7514,Movie,Motu Patlu: King of Kings,India,7/6/2017,2016,TV-Y7-FV,"Children & Family Movies, Comedies",,,,,,,
s8066,Movie,Speech & Debate,United States,7/6/2017,2017,PG-13,"Comedies, Dramas, Independent Movies",,,,,,,
s5381,TV Show,Dawn of the Croods,United States,7/7/2017,2017,TV-Y7,Kids' TV,,,,,,,
s5382,TV Show,Degrassi: Next Class,Canada,7/7/2017,2017,TV-14,"International TV Shows, TV Dramas, Teen TV Shows",,,,,,,
s5383,TV Show,Diamond Lover,China,7/7/2017,2015,TV-PG,"International TV Shows, Romantic TV Shows, TV Dramas",,,,,,,
s5384,TV Show,Kingâ€™s War,China,7/7/2017,2012,TV-14,"International TV Shows, TV Dramas",,,,,,,
s5385,TV Show,Qin Empire: Alliance,China,7/7/2017,2012,TV-14,"International TV Shows, TV Dramas",,,,,,,
s5386,Movie,Take Me,United States,7/7/2017,2017,TV-MA,"Comedies, Independent Movies",,,,,,,
s5387,TV Show,The Legend of Bruce Lee,China,7/7/2017,2008,TV-14,"International TV Shows, TV Action & Adventure, TV Dramas",,,,,,,
s5981,Movie,1 Mile to You,United States,7/7/2017,2017,TV-14,"Dramas, Romantic Movies, Sports Movies",,,,,,,
s7989,Movie,Sex Doll,"United Kingdom, France",7/10/2017,2016,UR,"Dramas, International Movies, Romantic Movies",,,,,,,
s6874,TV Show,Gonul,Turkey,7/12/2017,2015,TV-14,"International TV Shows, TV Dramas, TV Thrillers",,,,,,,
s5379,Movie,D.L. Hughley: Clear,United States,7/13/2017,2014,TV-MA,Stand-Up Comedy,,,,,,,
s5380,Movie,Tom Segura: Completely Normal,United States,7/13/2017,2014,TV-MA,Stand-Up Comedy,,,,,,,
s7546,Movie,My Scientology Movie,United Kingdom,7/13/2017,2015,TV-MA,Documentaries,,,,,,,
s5376,Movie,Buddy Thunderstruck: The Maybe Pile,United States,7/14/2017,2017,TV-Y7,"Children & Family Movies, Comedies",,,,,,,
s5377,Movie,Chasing Coral,United States,7/14/2017,2017,TV-PG,Documentaries,,,,,,,
s5378,Movie,To the Bone,United States,7/14/2017,2017,TV-MA,"Dramas, Independent Movies",,,,,,,
s5375,Movie,Amar,Spain,7/15/2017,2017,TV-MA,"Dramas, International Movies, Romantic Movies",,,,,,,
s8024,Movie,Singh Saab the Great,India,7/15/2017,2013,TV-14,"Action & Adventure, Dramas, International Movies",,,,,,,
s8682,Movie,Vitti Dandu,India,7/15/2017,2014,TV-14,"Dramas, International Movies",,,,,,,
s5374,Movie,Uncertain Glory,Spain,7/17/2017,2017,TV-MA,"Dramas, International Movies",,,,,,,
s5372,Movie,Aditi Mittal: Things They Wouldn't Let Me Say,India,7/18/2017,2017,TV-MA,Stand-Up Comedy,,,,,,,
s5373,TV Show,Ari Shaffir: Double Negative,United States,7/18/2017,2017,TV-MA,Stand-Up Comedy & Talk Shows,,,,,,,
s8571,Movie,Theater of Life,Canada,7/18/2017,2016,TV-PG,Documentaries,,,,,,,
s7086,TV Show,Intelligence,Canada,7/19/2017,2007,TV-MA,"Crime TV Shows, TV Dramas",,,,,,,
s7012,Movie,"Houston, We Have a Problem!","Slovenia, Croatia, Germany, Czech Republic, Qatar",7/20/2017,2016,TV-14,"Comedies, Independent Movies, International Movies",,,,,,,
s8430,TV Show,The Most Beautiful Hands of Delhi,Sweden,7/20/2017,2017,TV-MA,"International TV Shows, TV Comedies, TV Dramas",,,,,,,
s6490,Movie,City of Tiny Lights,United Kingdom,7/21/2017,2016,TV-MA,"Dramas, International Movies, Thrillers",,,,,,,
s5371,Movie,I Called Him Morgan,"Sweden, United States",7/24/2017,2016,TV-14,"Documentaries, Music & Musicals",,,,,,,
s8676,Movie,Victor,United States,7/24/2017,2015,PG-13,Dramas,,,,,,,
s5370,Movie,Joe Mandeâ€™s Award-Winning Comedy Special,United States,7/25/2017,2017,TV-MA,Stand-Up Comedy,,,,,,,
s5368,TV Show,Daughters of Destiny,United States,7/28/2017,2017,TV-14,Docuseries,,,,,,,
s5369,Movie,The Incredible Jessica James,United States,7/28/2017,2017,TV-MA,"Comedies, Independent Movies, Romantic Movies",,,,,,,
s6607,Movie,Diana: 7 Days That Shook the World,United Kingdom,7/28/2017,2017,TV-PG,Documentaries,,,,,,,
s7330,Movie,Loco Love,Mexico,7/30/2017,2017,TV-MA,"Dramas, Independent Movies, International Movies",,,,,,,
s5348,TV Show,Bountiful Blessings,Singapore,8/1/2017,2011,TV-14,"International TV Shows, TV Dramas, TV Sci-Fi & Fantasy",,,,,,,
s5349,TV Show,Close Your Eyes Before Itâ€™s Dark,Taiwan,8/1/2017,2016,TV-14,"Crime TV Shows, International TV Shows, TV Dramas",,,,,,,
s5350,TV Show,Entangled,South Korea,8/1/2017,2014,TV-14,"International TV Shows, TV Dramas",,,,,,,
s5351,TV Show,Fartsa,Russia,8/1/2017,2015,TV-14,"Crime TV Shows, International TV Shows, TV Dramas",,,,,,,
s5352,Movie,Handsome Devil,Ireland,8/1/2017,2016,TV-MA,"Comedies, Dramas, International Movies",,,,,,,
s5353,TV Show,"Have You Ever Fallen in Love, Miss Jiang?",,8/1/2017,2016,TV-14,"Crime TV Shows, International TV Shows, TV Dramas",,,,,,,
s5354,Movie,Jessica Darling's It List,United States,8/1/2017,2016,TV-Y,"Children & Family Movies, Comedies",,,,,,,
s5355,TV Show,Life Plan A and B,Taiwan,8/1/2017,2016,TV-PG,"International TV Shows, Romantic TV Shows, TV Dramas",,,,,,,
s5356,TV Show,Locust,Russia,8/1/2017,2014,TV-MA,"Crime TV Shows, International TV Shows, Romantic TV Shows",,,,,,,
s5357,TV Show,Love Storm,,8/1/2017,2016,TV-14,"International TV Shows, Romantic TV Shows, TV Comedies",,,,,,,
s5358,Movie,Maz Jobrani: Immigrant,,8/1/2017,2017,TV-14,Stand-Up Comedy,,,,,,,
s5359,Movie,Opening Night,United States,8/1/2017,2016,TV-MA,"Comedies, Independent Movies, Music & Musicals",,,,,,,
s5360,Movie,Raising the Bar,Australia,8/1/2017,2016,TV-Y,"Children & Family Movies, Dramas, Sports Movies",,,,,,,
s5361,TV Show,Surviving Escobar - Alias JJ,,8/1/2017,2017,TV-MA,"Crime TV Shows, International TV Shows, Spanish-Language TV Shows",,,,,,,
s5362,Movie,The Blind Christ,"Chile, France",8/1/2017,2016,TV-MA,"Dramas, Independent Movies, International Movies",,,,,,,
s5363,TV Show,The In-Laws,Singapore,8/1/2017,2011,TV-14,"International TV Shows, TV Dramas",,,,,,,
s5364,TV Show,The IT Crowd,United Kingdom,8/1/2017,2013,TV-MA,"British TV Shows, Classic & Cult TV, International TV Shows",,,,,,,
s5365,Movie,Un plus une,France,8/1/2017,2015,TV-MA,"Comedies, Dramas, International Movies",,,,,,,
s5366,TV Show,Vexed,United Kingdom,8/1/2017,2012,TV-MA,"British TV Shows, Crime TV Shows, International TV Shows",,,,,,,
s5367,TV Show,World War II in Colour,United Kingdom,8/1/2017,2009,TV-MA,"British TV Shows, Docuseries, International TV Shows",,,,,,,
s6059,Movie,A Sort of Homecoming,United States,8/1/2017,2015,TV-PG,"Dramas, Independent Movies",,,,,,,
s6119,Movie,All Hallows' Eve,United States,8/1/2017,2016,TV-G,"Children & Family Movies, Independent Movies",,,,,,,
s6160,Movie,Anarkali of Aarah,India,8/1/2017,2017,TV-MA,"Dramas, Independent Movies, International Movies",,,,,,,
s6170,Movie,Annabelle Hooper and the Ghosts of Nantucket,United States,8/1/2017,2016,TV-PG,Children & Family Movies,,,,,,,
s6199,TV Show,Aussie Gold Hunters,Australia,8/1/2017,2016,TV-MA,"Docuseries, International TV Shows, Reality TV",,,,,,,
s6281,Movie,Below Her Mouth,Canada,8/1/2017,2016,TV-MA,"Dramas, Independent Movies, International Movies",,,,,,,
s6502,Movie,Cloud Atlas,"Germany, United States, Hong Kong, Singapore",8/1/2017,2012,R,"Action & Adventure, Cult Movies, Dramas",,,,,,,
s6536,Movie,Cop Watchers,,8/1/2017,2016,TV-MA,"Documentaries, International Movies",,,,,,,
s6715,TV Show,Everyday Miracles,United Kingdom,8/1/2017,2014,TV-PG,"British TV Shows, Docuseries, International TV Shows",,,,,,,
s6835,TV Show,Genius of the Ancient World,United Kingdom,8/1/2017,2015,TV-PG,"British TV Shows, Docuseries, International TV Shows",,,,,,,
s6836,TV Show,Genius of the Modern World,United Kingdom,8/1/2017,2016,TV-PG,"British TV Shows, Docuseries, International TV Shows",,,,,,,
s6972,TV Show,Hinterland,United Kingdom,8/1/2017,2016,TV-14,"British TV Shows, Crime TV Shows, International TV Shows",,,,,,,
s6982,TV Show,Hogie the Globehopper,United States,8/1/2017,2016,TV-Y,Kids' TV,,,,,,,
s7267,TV Show,Land Girls,United Kingdom,8/1/2017,2011,TV-14,"British TV Shows, International TV Shows, TV Dramas",,,,,,,
s7630,TV Show,Nurses Who Kill,United Kingdom,8/1/2017,2016,TV-14,"British TV Shows, Crime TV Shows, Docuseries",,,,,,,
s8216,Movie,The Bomb,United States,8/1/2017,2016,TV-14,Documentaries,,,,,,,
s8539,Movie,The Truth About Alcohol,United Kingdom,8/1/2017,2016,TV-14,"Documentaries, International Movies",,,,,,,
s8562,Movie,The Women Who Kill Lions,United Kingdom,8/1/2017,2016,TV-MA,"Documentaries, International Movies",,,,,,,
s8685,TV Show,Vroomiz,South Korea,8/1/2017,2016,TV-Y,"Kids' TV, Korean TV Shows",,,,,,,
s8750,TV Show,Winter Sun,Turkey,8/1/2017,2014,TV-MA,"International TV Shows, TV Dramas, TV Thrillers",,,,,,,
s5347,Movie,The Invisible Guardian,"Spain, Germany",8/3/2017,2017,TV-MA,"International Movies, Thrillers",,,,,,,
s5343,Movie,Alan SaldaÃ±a: Mi vida de pobre,Mexico,8/4/2017,2017,TV-MA,Stand-Up Comedy,,,,,,,
s5344,Movie,Icarus,United States,8/4/2017,2017,TV-MA,"Documentaries, Sports Movies",,,,,,,
s5345,Movie,Message from the King,"United Kingdom, France, Belgium, United States",8/4/2017,2017,R,"Independent Movies, Thrillers",,,,,,,
s5346,TV Show,Wet Hot American Summer: Ten Years Later,United States,8/4/2017,2017,TV-MA,TV Comedies,,,,,,,
s6080,TV Show,Abnormal Summit,South Korea,8/4/2017,2017,TV-PG,"International TV Shows, Korean TV Shows, Stand-Up Comedy & Talk Shows",,,,,,,
s6458,TV Show,Chef & My Fridge,South Korea,8/4/2017,2017,TV-PG,"International TV Shows, Korean TV Shows, Reality TV",,,,,,,
s6614,TV Show,Dino Hunt,Canada,8/4/2017,2016,TV-G,"Docuseries, Science & Nature TV",,,,,,,
s7706,TV Show,Paranormal Survivor,Canada,8/4/2017,2016,TV-14,Docuseries,,,,,,,
s5342,Movie,Enter the Warriors Gate,"France, Canada, China, Cambodia",8/5/2017,2016,PG-13,"Action & Adventure, International Movies, Sci-Fi & Fantasy",,,,,,,
s7262,Movie,Lady Bloodfight,Hong Kong,8/5/2017,2016,R,Action & Adventure,,,,,,,
s7673,Movie,Operation Mekong,"China, Hong Kong",8/5/2017,2016,TV-MA,"Action & Adventure, International Movies",,,,,,,
s8034,Movie,Sky on Fire,"China, Hong Kong",8/5/2017,2016,TV-MA,"Action & Adventure, International Movies",,,,,,,
s5341,Movie,LEGO Marvel Super Heroes: Avengers Reassembled!,United States,8/6/2017,2015,TV-Y7,Children & Family Movies,,,,,,,
s7117,Movie,Jake's Buccaneer Blast,,8/6/2017,2014,TV-Y,Movies,,,,,,,
s5335,Movie,Baahubali 2: The Conclusion (Hindi Version),India,8/7/2017,2017,TV-MA,"Action & Adventure, Dramas, International Movies",,,,,,,
s5336,Movie,Baahubali 2: The Conclusion (Malayalam Version),,8/7/2017,2017,TV-14,"Action & Adventure, Dramas, International Movies",,,,,,,
s5337,Movie,Baahubali 2: The Conclusion (Tamil Version),,8/7/2017,2017,TV-MA,"Action & Adventure, Dramas, International Movies",,,,,,,
s5338,Movie,Baahubali: The Beginning (Hindi Version),India,8/7/2017,2015,TV-14,"Action & Adventure, Dramas, International Movies",,,,,,,
s5339,Movie,Baahubali: The Beginning (Malayalam Version),,8/7/2017,2015,TV-14,"Action & Adventure, Dramas, International Movies",,,,,,,
s5340,Movie,Baahubali: The Beginning (Tamil Version),,8/7/2017,2015,TV-14,"Action & Adventure, Dramas, International Movies",,,,,,,
s7474,Movie,Mission: Destroy Love,Malaysia,8/7/2017,2014,TV-PG,"Comedies, International Movies, Romantic Movies",,,,,,,
s8212,Movie,The Black Room,United States,8/7/2017,2016,TV-MA,Horror Movies,,,,,,,
s6594,Movie,Denis Leary: No Cure For Cancer,United States,8/8/2017,1992,R,Stand-Up Comedy,,,,,,,
s6327,Movie,Black Site Delta,United States,8/9/2017,2017,TV-MA,Action & Adventure,,,,,,,
s5333,Movie,Demonic,United States,8/10/2017,2015,R,"Horror Movies, Independent Movies",,,,,,,
s5334,Movie,The Saint,United States,8/10/2017,2017,TV-14,Action & Adventure,,,,,,,
s6115,Movie,Alive and Kicking,"Sweden, United States",8/10/2017,2016,TV-14,Documentaries,,,,,,,
s8012,Movie,SHOT! The Psycho-Spiritual Mantra of Rock,"United Kingdom, United States",8/10/2017,2016,TV-MA,"Documentaries, Music & Musicals",,,,,,,
s5332,Movie,Naked,United States,8/11/2017,2017,TV-14,"Comedies, Romantic Movies",,,,,,,
s5330,Movie,Chocolate City: Vegas Strip,United States,8/12/2017,2017,TV-MA,Dramas,,,,,,,
s5331,Movie,Los Herederos,Mexico,8/12/2017,2015,TV-MA,"Dramas, International Movies",,,,,,,
s7005,Movie,Hot Property,United Kingdom,8/13/2017,2016,TV-MA,"Comedies, Independent Movies",,,,,,,
s7472,Movie,Mission Control: The Unsung Heroes of Apollo,"United States, United Kingdom",8/13/2017,2017,TV-14,Documentaries,,,,,,,
s5329,Movie,The Outcasts,United States,8/14/2017,2017,TV-14,Comedies,,,,,,,
s6102,TV Show,Age of Glory,,8/14/2017,2010,TV-MA,"International TV Shows, Romantic TV Shows, TV Dramas",,,,,,,
s6719,TV Show,Exclusive Edition,,8/14/2017,2008,TV-14,"International TV Shows, TV Dramas",,,,,,,
s6858,TV Show,Glowing Embers,,8/14/2017,2010,TV-14,"International TV Shows, TV Dramas",,,,,,,
s5325,TV Show,20 Minutes,Turkey,8/15/2017,2013,TV-MA,"Crime TV Shows, International TV Shows, TV Dramas",,,,,,,
s5326,Movie,Brad Paisley's Comedy Rodeo,United States,8/15/2017,2017,TV-MA,"Music & Musicals, Stand-Up Comedy",,,,,,,
s5327,Movie,Colin Quinn: Unconstitutional,United States,8/15/2017,2015,TV-MA,Stand-Up Comedy,,,,,,,
s5328,TV Show,Million Yen Women,Japan,8/15/2017,2017,TV-MA,"Crime TV Shows, International TV Shows, TV Dramas",,,,,,,
s6234,Movie,Barbecue,"Australia, Armenia, Japan, Jordan, Mexico, Mongolia, New Zealand, Philippines, South Africa, Sweden, United States, Uruguay",8/15/2017,2017,TV-MA,"Documentaries, International Movies",,,,,,,
s6883,Movie,Goon,"United States, Canada",8/15/2017,2011,R,"Comedies, Sports Movies",,,,,,,
s7537,Movie,My Ex-Ex,Canada,8/15/2017,2015,TV-MA,"Comedies, Romantic Movies",,,,,,,
s8709,Movie,We're No Animals,"United States, Argentina",8/15/2017,2015,TV-MA,"Comedies, Dramas, Independent Movies",,,,,,,
s7126,TV Show,Jericho,United States,8/16/2017,2008,TV-14,"Classic & Cult TV, TV Action & Adventure, TV Dramas",,,,,,,
s6535,Movie,Cop and a Half: New Recruit,Canada,8/17/2017,2017,PG,"Children & Family Movies, Comedies",,,,,,,
s5321,TV Show,Dinotrux,United States,8/18/2017,2017,TV-Y7,Kids' TV,,,,,,,
s5322,TV Show,Marvel's The Defenders,United States,8/18/2017,2017,TV-MA,"Crime TV Shows, TV Action & Adventure, TV Dramas",,,,,,,
s5323,Movie,Undefeated,United States,8/18/2017,2011,PG-13,"Documentaries, Sports Movies",,,,,,,
s5324,Movie,What Happened to Monday,"United Kingdom, France, United States, Belgium",8/18/2017,2017,TV-MA,"Action & Adventure, Sci-Fi & Fantasy",,,,,,,
s6968,Movie,Hide and Seek,China,8/19/2017,2016,TV-14,"International Movies, Thrillers",,,,,,,
s7824,Movie,Railroad Tigers,China,8/19/2017,2016,TV-14,"Action & Adventure, Comedies, International Movies",,,,,,,
s6410,Movie,Camera Store,United States,8/20/2017,2016,TV-MA,"Comedies, Dramas",,,,,,,
s6216,Movie,Bad Rap,"United States, Canada",8/21/2017,2016,TV-MA,"Documentaries, Music & Musicals",,,,,,,
s6872,TV Show,Gomorrah,"Italy, Germany",8/21/2017,2016,TV-MA,"Crime TV Shows, International TV Shows, TV Dramas",,,,,,,
s6938,TV Show,Hati Perempuan,Indonesia,8/21/2017,2015,TV-14,"International TV Shows, Romantic TV Shows, TV Dramas",,,,,,,
s7217,Movie,KL Zombi,Malaysia,8/21/2017,2013,TV-14,"Comedies, Horror Movies, International Movies",,,,,,,
s7853,Movie,Rembat,Malaysia,8/21/2017,2015,TV-PG,"Action & Adventure, Comedies, International Movies",,,,,,,
s8657,Movie,Unacknowledged,United States,8/21/2017,2017,TV-MA,Documentaries,,,,,,,
s5320,Movie,Lynne Koplitz: Hormonal Beast,United States,8/22/2017,2017,TV-MA,Stand-Up Comedy,,,,,,,
s7917,Movie,Sadie's Last Days on Earth,Canada,8/22/2017,2016,TV-14,"Comedies, Sci-Fi & Fantasy",,,,,,,
s6746,Movie,Feel Rich,United States,8/23/2017,2017,TV-MA,Documentaries,,,,,,,
s5318,Movie,Berlin Syndrome,Australia,8/25/2017,2017,R,"International Movies, Thrillers",,,,,,,
s5319,Movie,Death Note,United States,8/25/2017,2017,TV-MA,"Horror Movies, Thrillers",,,,,,,
s6274,Movie,"Behind ""The Cove"": The Quiet Japanese Speak Out","Japan, United States",8/25/2017,2015,TV-14,"Documentaries, International Movies",,,,,,,
s7724,Movie,Pekak,Malaysia,8/25/2017,2016,TV-MA,"Dramas, International Movies",,,,,,,
s5317,Movie,Buster's Mal Heart,United States,8/26/2017,2016,TV-MA,"Independent Movies, Thrillers",,,,,,,
s7375,Movie,Madre,Chile,8/26/2017,2016,TV-MA,"International Movies, Thrillers",,,,,,,
s7445,Movie,Menorca,"Canada, Spain",8/27/2017,2016,TV-MA,"Dramas, Independent Movies",,,,,,,
s6009,Movie,3 Generations,United States,8/28/2017,2015,PG-13,"Dramas, LGBTQ Movies",,,,,,,
s5316,Movie,Ryan Hamilton: Happy Face,United States,8/29/2017,2017,TV-14,Stand-Up Comedy,,,,,,,
s6378,Movie,Bring It On: Worldwide Showdown,United States,8/29/2017,2017,PG-13,Comedies,,,,,,,
s8287,Movie,The Eichmann Show,"United Kingdom, Lithuania",8/31/2017,2015,TV-MA,"Dramas, International Movies",,,,,,,
s5289,TV Show,A Boy Name Flora A,Taiwan,9/1/2017,2017,TV-MA,"International TV Shows, TV Comedies, TV Dramas",,,,,,,
s5290,TV Show,A House of Blocks,Taiwan,9/1/2017,2017,TV-PG,"International TV Shows, TV Dramas, TV Horror",,,,,,,
s5291,Movie,Aakhri Adaalat,India,9/1/2017,1988,TV-14,"Action & Adventure, International Movies",,,,,,,
s5292,Movie,"Alias JJ, la celebridad del mal",,9/1/2017,2017,TV-MA,"Documentaries, International Movies",,,,,,,
s5293,Movie,Berserk: The Golden Age Arc II - The Battle for Doldrey,Japan,9/1/2017,2012,TV-MA,"Action & Adventure, Anime Features, International Movies",,,,,,,
s5294,Movie,Berserk: The Golden Age Arc III - The Advent,Japan,9/1/2017,2013,TV-MA,"Action & Adventure, Anime Features, International Movies",,,,,,,
s5295,Movie,Brother's Shadow,United States,9/1/2017,2006,TV-MA,"Dramas, Independent Movies",,,,,,,
s5296,Movie,Chadi Jawani Budhe Nu,India,9/1/2017,1976,TV-PG,"Comedies, International Movies, Romantic Movies",,,,,,,
s5297,Movie,Ek Jaan Hain Hum,India,9/1/2017,1983,TV-14,"Dramas, International Movies, Music & Musicals",,,,,,,
s5298,TV Show,FINAL FANTASY XIV Dad of Light,Japan,9/1/2017,2017,TV-PG,"International TV Shows, TV Dramas",,,,,,,
s5299,TV Show,Gurren Lagann,Japan,9/1/2017,2007,TV-14,"Anime Series, International TV Shows",,,,,,,
s5300,TV Show,High Risk,United States,9/1/2017,1988,TV-PG,"Docuseries, Reality TV",,,,,,,
s5301,Movie,Khoon Khoon,India,9/1/2017,1973,TV-14,"Action & Adventure, International Movies",,,,,,,
s5302,TV Show,LEGO Elves: Secrets of Elvendale,United States,9/1/2017,2017,TV-Y7,Kids' TV,,,,,,,
s5303,Movie,Little Evil,United States,9/1/2017,2017,TV-MA,"Comedies, Horror Movies",,,,,,,
s5304,Movie,Manoranjan,India,9/1/2017,1974,TV-14,"Comedies, International Movies, Music & Musicals",,,,,,,
s5305,Movie,Mujrim,India,9/1/2017,1989,TV-14,"Action & Adventure, Dramas, International Movies",,,,,,,
s5306,TV Show,Narcos,"United States, Colombia, Mexico",9/1/2017,2017,TV-MA,"Crime TV Shows, TV Action & Adventure, TV Dramas",,,,,,,
s5307,Movie,Offline - Das leben ist kein bonuslevel,Germany,9/1/2017,2016,TV-MA,"Action & Adventure, Comedies, International Movies",,,,,,,
s5308,Movie,Resurface,United States,9/1/2017,2017,TV-MA,"Documentaries, Sports Movies",,,,,,,
s5309,Movie,Rocco,France,9/1/2017,2016,TV-MA,"Documentaries, International Movies",,,,,,,
s5310,Movie,Sohni Mahiwal,"India, Soviet Union",9/1/2017,1984,TV-14,"Dramas, International Movies, Romantic Movies",,,,,,,
s5311,Movie,The Distinguished Citizen,"Argentina, Spain",9/1/2017,2016,TV-MA,"Comedies, Dramas, International Movies",,,,,,,
s5312,Movie,The Guardian Brothers,China,9/1/2017,2016,TV-G,"Children & Family Movies, Comedies",,,,,,,
s5313,Movie,The Last Shaman,"United Kingdom, Italy, Israel, Peru, United States",9/1/2017,2016,TV-14,"Documentaries, International Movies",,,,,,,
s5314,Movie,The Lost Brother,"Argentina, Uruguay, Spain, France",9/1/2017,2017,TV-MA,"Dramas, International Movies",,,,,,,
s5315,Movie,Todo Sobre El Asado,Argentina,9/1/2017,2016,TV-MA,"Documentaries, International Movies",,,,,,,
s6526,Movie,Concrete Football,"Czech Republic, France",9/1/2017,2016,TV-MA,"Documentaries, International Movies, Sports Movies",,,,,,,
s7067,Movie,Incorruptible,"United States, Senegal",9/1/2017,2015,TV-MA,Documentaries,,,,,,,
s7089,Movie,Inuyasha the Movie - L'isola del fuoco scarlatto,Japan,9/1/2017,2004,TV-PG,"Action & Adventure, Anime Features, International Movies",,,,,,,
s7090,Movie,Inuyasha the Movie - La spada del dominatore del mondo,Japan,9/1/2017,2003,TV-14,"Action & Adventure, Anime Features, International Movies",,,,,,,
s7091,Movie,InuYasha: The Movie 2: The Castle Beyond the Looking Glass,Japan,9/1/2017,2002,TV-14,"Action & Adventure, Anime Features, International Movies",,,,,,,
s7338,Movie,Lorai: Play to Live,India,9/1/2017,2015,TV-14,"Dramas, International Movies, Sports Movies",,,,,,,
s7560,Movie,Naruto Shippuden : Blood Prison,Japan,9/1/2017,2011,TV-14,"Action & Adventure, Anime Features, International Movies",,,,,,,
s8282,Movie,The Drowning,"United States, Hong Kong",9/1/2017,2016,TV-MA,Thrillers,,,,,,,
s8597,TV Show,Tip the Mouse,"Germany, United States, Italy",9/1/2017,2014,TV-Y,Kids' TV,,,,,,,
s8600,TV Show,Toast of London,United Kingdom,9/1/2017,2015,TV-MA,"British TV Shows, Classic & Cult TV, TV Comedies",,,,,,,
s8735,Movie,Who the F**k Is That Guy?,United States,9/1/2017,2017,TV-MA,"Documentaries, LGBTQ Movies, Music & Musicals",,,,,,,
s6318,Movie,Bitcoin Heist,Vietnam,9/2/2017,2016,TV-14,"Action & Adventure, Comedies, International Movies",,,,,,,
s7041,Movie,I Am Not Madame Bovary,China,9/2/2017,2016,TV-14,"Comedies, Dramas, International Movies",,,,,,,
s8679,Movie,Vincent N Roxxy,United States,9/2/2017,2016,R,"Dramas, Thrillers",,,,,,,
s5287,TV Show,Frequency,United States,9/4/2017,2016,TV-14,"Crime TV Shows, TV Dramas, TV Mysteries",,,,,,,
s5288,TV Show,The Vampire Diaries,United States,9/4/2017,2016,TV-14,"TV Dramas, TV Mysteries, TV Sci-Fi & Fantasy",,,,,,,
s5283,Movie,Carrie Pilby,United States,9/5/2017,2016,TV-MA,"Comedies, Dramas",,,,,,,
s5284,Movie,Marc Maron: Too Real,United States,9/5/2017,2017,TV-MA,Stand-Up Comedy,,,,,,,
s5285,TV Show,No Tomorrow,United States,9/5/2017,2016,TV-PG,"Romantic TV Shows, TV Comedies, TV Dramas",,,,,,,
s5286,TV Show,Reign,United States,9/5/2017,2017,TV-14,TV Dramas,,,,,,,
s6925,Movie,Hard Tide,United Kingdom,9/6/2017,2015,TV-MA,"Dramas, Independent Movies",,,,,,,
s6397,Movie,CÃ©zanne et moi,"Belgium, France",9/7/2017,2016,R,"Dramas, Independent Movies, International Movies",,,,,,,
s5278,Movie,#realityhigh,United States,9/8/2017,2017,TV-14,Comedies,,,,,,,
s5279,TV Show,Apaches,Spain,9/8/2017,2016,TV-MA,"Crime TV Shows, International TV Shows, Spanish-Language TV Shows",,,,,,,
s5280,Movie,Fabrizio Copano: Solo pienso en mi,Chile,9/8/2017,2017,TV-MA,Stand-Up Comedy,,,,,,,
s5281,TV Show,Fire Chasers,United States,9/8/2017,2017,TV-MA,"Docuseries, Science & Nature TV",,,,,,,
s5282,Movie,JoaquÃ­n Reyes: Una y no mÃ¡s,,9/8/2017,2017,TV-MA,Stand-Up Comedy,,,,,,,
s6200,Movie,Automata,"Bulgaria, United States, Spain, Canada",9/8/2017,2014,R,"International Movies, Sci-Fi & Fantasy, Thrillers",,,,,,,
s6880,Movie,Good People,"United States, United Kingdom, Denmark, Sweden",9/8/2017,2014,R,"Action & Adventure, Thrillers",,,,,,,
s7196,Movie,Kidnapping Mr. Heineken,"Netherlands, Belgium, United Kingdom, United States",9/8/2017,2015,R,"Action & Adventure, Dramas, International Movies",,,,,,,
s7227,Movie,Krish Trish and Baltiboy,,9/8/2017,2009,TV-Y7,Children & Family Movies,,,,,,,
