show_id,type,title,country,date_added,release_year,rating,listed_in,Date,Open,High,Low,Close,Adj_close,Volume
s7453,Movie,Middle School: The Worst Years of My Life,"United States, Cambodia",3/3/2019,2016,PG,"Children & Family Movies, Comedies",,,,,,,
s4047,Movie,Everyday I Love You,Philippines,3/4/2019,2015,TV-14,"Dramas, International Movies, Romantic Movies",,,,,,,
s4048,Movie,No Other Woman,Philippines,3/4/2019,2011,TV-MA,"Dramas, International Movies, Romantic Movies",,,,,,,
s7036,Movie,I Am,"India, Japan",3/4/2019,2010,TV-MA,"Dramas, Independent Movies, International Movies",,,,,,,
s7195,Movie,Kid Kulafu,Philippines,3/4/2019,2015,TV-14,"Dramas, International Movies, Sports Movies",,,,,,,
s7544,Movie,My Only Mother,,3/4/2019,2013,TV-14,"Comedies, Dramas, International Movies",,,,,,,
s8271,Movie,The Dawn Wall,"Austria, United States",3/4/2019,2017,TV-MA,"Documentaries, Sports Movies",,,,,,,
s4045,TV Show,A Korean Odyssey,South Korea,3/5/2019,2017,TV-MA,"International TV Shows, Korean TV Shows, Romantic TV Shows",,,,,,,
s4046,Movie,The Hard Way,United States,3/5/2019,2019,TV-MA,Action & Adventure,,,,,,,
s6272,Movie,Bedtime Stories,United States,3/5/2019,2008,PG,"Children & Family Movies, Comedies",,,,,,,
s6422,Movie,Caregiver,Philippines,3/5/2019,2008,TV-14,"Dramas, International Movies",,,,,,,
s6482,Movie,Christopher Robin,United States,3/5/2019,2018,PG,"Children & Family Movies, Comedies, Dramas",,,,,,,
s4043,TV Show,American Crime Story: The People v. O.J. Simpson,United States,3/6/2019,2016,TV-MA,"Crime TV Shows, TV Dramas",,,,,,,
s4044,TV Show,Secret City,Australia,3/6/2019,2016,TV-MA,"International TV Shows, TV Dramas, TV Mysteries",,,,,,,
s4038,Movie,Nappily Ever After,United States,3/7/2019,2018,TV-MA,"Comedies, Dramas, Romantic Movies",,,,,,,
s4039,Movie,Sisterakas,Philippines,3/7/2019,2012,TV-14,"Comedies, International Movies",,,,,,,
s4040,Movie,Starting Over Again,Philippines,3/7/2019,2014,TV-14,"Dramas, International Movies, Romantic Movies",,,,,,,
s4041,Movie,That Thing Called Tadhana,Philippines,3/7/2019,2015,TV-MA,"Dramas, International Movies, Romantic Movies",,,,,,,
s4042,Movie,The Love Affair,Philippines,3/7/2019,2015,TV-MA,"Dramas, International Movies, Romantic Movies",,,,,,,
s6638,Movie,Doubt,United States,3/7/2019,2008,PG-13,"Dramas, Faith & Spirituality",,,,,,,
s4030,TV Show,Bangkok Love Stories: Hey You!,,3/8/2019,2018,TV-14,"International TV Shows, Romantic TV Shows, TV Dramas",,,,,,,
s4031,TV Show,Disappearance,Egypt,3/8/2019,2018,TV-MA,"International TV Shows, TV Dramas, TV Mysteries",,,,,,,
s4032,Movie,Hajwala 2: Mysterious Mission,United Arab Emirates,3/8/2019,2018,TV-14,"Action & Adventure, Comedies, International Movies",,,,,,,
s4033,TV Show,Immortals,Turkey,3/8/2019,2018,TV-MA,"International TV Shows, TV Dramas, TV Horror",,,,,,,
s4034,Movie,Juanita,United States,3/8/2019,2019,TV-MA,"Dramas, Independent Movies, Romantic Movies",,,,,,,
s4035,Movie,Lady J,France,3/8/2019,2019,TV-MA,"Dramas, Independent Movies, International Movies",,,,,,,
s4036,TV Show,The Confrontation,,3/8/2019,2018,TV-PG,"International TV Shows, TV Dramas",,,,,,,
s4037,Movie,Walk. Ride. Rodeo.,United States,3/8/2019,2019,TV-PG,"Children & Family Movies, Dramas",,,,,,,
s6340,Movie,Blue Jasmine,United States,3/8/2019,2013,PG-13,"Comedies, Dramas, Independent Movies",,,,,,,
s8076,Movie,Spy Kids 2: The Island of Lost Dreams,United States,3/8/2019,2002,PG,"Children & Family Movies, Comedies",,,,,,,
s8357,Movie,The Imaginarium of Doctor Parnassus,"United Kingdom, Canada, France, United States",3/8/2019,2009,PG-13,"Action & Adventure, Sci-Fi & Fantasy",,,,,,,
s8373,Movie,The Jane Austen Book Club,United States,3/8/2019,2007,PG-13,"Comedies, Dramas, Romantic Movies",,,,,,,
s6181,Movie,Apollo 18,"United States, Canada",3/9/2019,2011,PG-13,"Horror Movies, Sci-Fi & Fantasy, Thrillers",,,,,,,
s6505,TV Show,Club Friday The Series 6,,3/9/2019,2015,TV-MA,"International TV Shows, Romantic TV Shows, TV Dramas",,,,,,,
s4029,TV Show,Into the Badlands,United States,3/10/2019,2018,TV-MA,TV Action & Adventure,,,,,,,
s4027,TV Show,Eugenie Nights,Egypt,3/11/2019,2018,TV-14,"International TV Shows, Romantic TV Shows, TV Dramas",,,,,,,
s4028,TV Show,This Evening,Egypt,3/11/2019,2017,TV-14,"International TV Shows, TV Dramas",,,,,,,
s4026,Movie,Jimmy Carr: The Best of Ultimate Gold Greatest Hits,,3/12/2019,2019,TV-MA,Stand-Up Comedy,,,,,,,
s6045,TV Show,A Man Called God,South Korea,3/12/2019,2010,TV-14,"Crime TV Shows, International TV Shows, Korean TV Shows",,,,,,,
s6402,TV Show,Cain and Abel,South Korea,3/12/2019,2009,TV-MA,"International TV Shows, Korean TV Shows, Romantic TV Shows",,,,,,,
s4023,TV Show,More to Say,Egypt,3/13/2019,2018,TV-14,"International TV Shows, TV Dramas, TV Mysteries",,,,,,,
s4024,TV Show,The Land of Hypocrisy,Egypt,3/13/2019,2018,TV-14,"International TV Shows, TV Comedies, TV Sci-Fi & Fantasy",,,,,,,
s4025,Movie,Triple Frontier,United States,3/13/2019,2019,R,Action & Adventure,,,,,,,
s4018,Movie,A Love Story,Philippines,3/14/2019,2007,TV-14,"Dramas, International Movies, Romantic Movies",,,,,,,
s4019,Movie,Barcelona: A Love Untold,Philippines,3/14/2019,2016,TV-14,"Dramas, International Movies, Romantic Movies",,,,,,,
s4020,Movie,Everything About Her,Philippines,3/14/2019,2016,TV-MA,"Comedies, Dramas, International Movies",,,,,,,
s4021,Movie,Finally Found Someone,Philippines,3/14/2019,2017,TV-14,"International Movies, Romantic Movies",,,,,,,
s4022,Movie,Seven Sundays,Philippines,3/14/2019,2017,TV-MA,"Comedies, Dramas, International Movies",,,,,,,
s5986,Movie,12 ROUND GUN,United States,3/14/2019,2017,TV-MA,"Dramas, Independent Movies, Sports Movies",,,,,,,
s4003,Movie,Bombairiya,"United Arab Emirates, United Kingdom, India",3/15/2019,2018,TV-MA,"Comedies, Dramas, International Movies",,,,,,,
s4004,Movie,Burn Out,"France, Belgium",3/15/2019,2017,TV-MA,"Action & Adventure, International Movies",,,,,,,
s4005,Movie,Edoardo Ferrario: Temi Caldi,Italy,3/15/2019,2019,TV-MA,Stand-Up Comedy,,,,,,,
s4006,Movie,Girl,"Netherlands, Belgium",3/15/2019,2018,R,"Dramas, International Movies, LGBTQ Movies",,,,,,,
s4007,TV Show,If I Hadn't Met You,Spain,3/15/2019,2018,TV-MA,"International TV Shows, Romantic TV Shows, TV Dramas",,,,,,,
s4008,Movie,Jeff Dunham: Arguing with Myself,United States,3/15/2019,2006,TV-MA,Stand-Up Comedy,,,,,,,
s4009,Movie,Jeff Dunham: Controlled Chaos,United States,3/15/2019,2011,TV-MA,Stand-Up Comedy,,,,,,,
s4010,Movie,Jeff Dunham: Minding the Monsters,United States,3/15/2019,2012,TV-MA,Stand-Up Comedy,,,,,,,
s4011,Movie,Jeff Dunham's Very Special Christmas Special,United States,3/15/2019,2008,TV-MA,Stand-Up Comedy,,,,,,,
s4012,Movie,Late Life: The Chien-Ming Wang Story,"United States, Taiwan",3/15/2019,2018,TV-14,"Documentaries, Sports Movies",,,,,,,
s4013,TV Show,My Pride,,3/15/2019,2018,TV-14,"International TV Shows, TV Dramas",,,,,,,
s4014,Movie,Paskal,Malaysia,3/15/2019,2018,TV-14,"Action & Adventure, Dramas, International Movies",,,,,,,
s4015,TV Show,Robozuna,United Kingdom,3/15/2019,2018,TV-Y7,"British TV Shows, Kids' TV",,,,,,,
s4016,TV Show,The Disappearance of Madeleine McCann,,3/15/2019,2019,TV-14,"Crime TV Shows, Docuseries",,,,,,,
s4017,TV Show,Turn Up Charlie,United Kingdom,3/15/2019,2019,TV-MA,"British TV Shows, International TV Shows, TV Comedies",,,,,,,
s6369,TV Show,Brain Games,United States,3/15/2019,2016,TV-G,"Docuseries, Science & Nature TV",,,,,,,
s6468,Movie,Chief Daddy,Nigeria,3/15/2019,2018,TV-MA,"Comedies, Dramas, International Movies",,,,,,,
s6819,Movie,G-Force,United States,3/15/2019,2009,PG,"Children & Family Movies, Comedies",,,,,,,
s8397,Movie,The Lives of Others,Germany,3/15/2019,2006,R,"Dramas, International Movies, Thrillers",,,,,,,
s8521,Movie,The Student,United States,3/15/2019,2017,TV-14,Thrillers,,,,,,,
s8605,TV Show,Top 10 Secrets and Mysteries,"United Kingdom, United States, Czech Republic",3/15/2019,2018,TV-14,"British TV Shows, Docuseries, Science & Nature TV",,,,,,,
s8646,Movie,Twinsanity,United States,3/15/2019,2018,TV-MA,"Horror Movies, Independent Movies, Thrillers",,,,,,,
s6057,Movie,A Separation,"Iran, France",3/16/2019,2011,PG-13,"Dramas, International Movies",,,,,,,
s4001,Movie,5 Flights Up,United States,3/17/2019,2014,PG-13,"Comedies, Dramas, Independent Movies",,,,,,,
s4002,TV Show,Green Door,Taiwan,3/17/2019,2019,TV-MA,"International TV Shows, Romantic TV Shows, TV Comedies",,,,,,,
s6116,Movie,All About Nina,United States,3/18/2019,2018,R,"Comedies, Dramas, Independent Movies",,,,,,,
s4000,Movie,Amy Schumer Growing,United States,3/19/2019,2019,TV-MA,Stand-Up Comedy,,,,,,,
s8049,Movie,Social Animals,United States,3/19/2019,2018,TV-MA,Documentaries,,,,,,,
s8596,Movie,Tinker',United States,3/19/2019,2018,TV-14,"Dramas, Independent Movies, Sci-Fi & Fantasy",,,,,,,
s3996,Movie,Alexis Viera: A Story of Surviving,Uruguay,3/20/2019,2019,TV-MA,"Documentaries, International Movies, Sports Movies",,,,,,,
s3997,TV Show,9-Feb,,3/20/2019,2018,TV-14,"International TV Shows, TV Dramas",,,,,,,
s3998,Movie,Imago,India,3/20/2019,2018,TV-PG,"Dramas, Independent Movies, International Movies",,,,,,,
s3999,TV Show,My Husband Won't Fit,Japan,3/20/2019,2019,TV-MA,"International TV Shows, Romantic TV Shows, TV Dramas",,,,,,,
s5965,TV Show,9-Feb,,3/20/2019,2018,TV-14,"International TV Shows, TV Dramas",,,,,,,
s6070,Movie,A.X.L.,United States,3/20/2019,2018,PG,"Action & Adventure, Children & Family Movies, Independent Movies",,,,,,,
s3988,Movie,Antoine Griezmann: The Making of a Legend,,3/21/2019,2019,TV-PG,"Documentaries, International Movies, Sports Movies",,,,,,,
s3989,TV Show,Bo on the Go!,Canada,3/21/2019,2007,TV-Y,Kids' TV,,,,,,,
s3990,TV Show,Stay Tuned!,Japan,3/21/2019,2019,TV-14,"International TV Shows, TV Comedies, TV Dramas",,,,,,,
s3991,Movie,The Amazing Praybeyt Benjamin,Philippines,3/21/2019,2014,TV-14,"Action & Adventure, Comedies, International Movies",,,,,,,
s3992,Movie,The Super Parental Guardians,Philippines,3/21/2019,2016,TV-14,"Action & Adventure, Comedies, International Movies",,,,,,,
s3993,Movie,The Third Party,Philippines,3/21/2019,2016,TV-MA,"Comedies, Dramas, International Movies",,,,,,,
s3994,Movie,The Unmarried Wife,Philippines,3/21/2019,2016,TV-MA,"Dramas, International Movies, Romantic Movies",,,,,,,
s3995,Movie,Vince and Kath and James,Philippines,3/21/2019,2016,TV-PG,"International Movies, Romantic Movies",,,,,,,
s8556,Movie,The Wedding Curse,Philippines,3/21/2019,2006,TV-PG,"Horror Movies, International Movies",,,,,,,
s3980,TV Show,Charlie's Colorforms City,United States,3/22/2019,2019,TV-Y,Kids' TV,,,,,,,
s3981,TV Show,Crime Diaries: The Candidate,Mexico,3/22/2019,2019,TV-MA,"Crime TV Shows, International TV Shows, Spanish-Language TV Shows",,,,,,,
s3982,TV Show,Delhi Crime,India,3/22/2019,2019,TV-MA,"Crime TV Shows, International TV Shows, TV Dramas",,,,,,,
s3983,Movie,Mirage,Spain,3/22/2019,2018,TV-MA,"Dramas, International Movies, Sci-Fi & Fantasy",,,,,,,
s3984,Movie,ReMastered: The Miami Showband Massacre,United States,3/22/2019,2019,TV-MA,"Documentaries, Music & Musicals",,,,,,,
s3985,TV Show,The 10 Sins,,3/22/2019,2018,TV-14,"International TV Shows, TV Dramas",,,,,,,
s3986,Movie,The Dirt,United States,3/22/2019,2019,TV-MA,"Comedies, Dramas, Music & Musicals",,,,,,,
s3987,TV Show,The OA,United States,3/22/2019,2019,TV-MA,"TV Dramas, TV Mysteries, TV Sci-Fi & Fantasy",,,,,,,
s8492,Movie,The Rolling Stones: OlÃ© OlÃ© OlÃ©! A Trip Across Latin America,United Kingdom,3/22/2019,2016,TV-MA,"Documentaries, International Movies, Music & Musicals",,,,,,,
s3979,Movie,Oversize Cops,Thailand,3/23/2019,2017,TV-MA,"Action & Adventure, Comedies, International Movies",,,,,,,
s6652,TV Show,"Drugs, Inc.",United States,3/23/2019,2015,TV-MA,"Crime TV Shows, Docuseries",,,,,,,
s7045,Movie,I Don't Know How She Does It,United States,3/23/2019,2011,PG-13,Comedies,,,,,,,
s3978,Movie,Superlopez,Spain,3/24/2019,2018,TV-MA,"Action & Adventure, Comedies, International Movies",,,,,,,
s3976,Movie,Sei,India,3/25/2019,2018,TV-14,"Action & Adventure, Comedies, Dramas",,,,,,,
s3977,TV Show,The Eagle of El-Se'eed,,3/25/2019,2018,TV-14,"Crime TV Shows, International TV Shows, TV Action & Adventure",,,,,,,
s3975,Movie,Nate Bargatze: The Tennessee Kid,United States,3/26/2019,2019,TV-PG,Stand-Up Comedy,,,,,,,
s3973,Movie,Danur: I Can See Ghosts,Indonesia,3/27/2019,2017,TV-MA,"Horror Movies, International Movies",,,,,,,
s3974,Movie,Verses of Love,Indonesia,3/27/2019,2008,TV-PG,"Dramas, International Movies, Romantic Movies",,,,,,,
s3972,TV Show,Ainori Love Wagon: Asian Journey,Japan,3/28/2019,2018,TV-MA,"International TV Shows, Reality TV, Romantic TV Shows",,,,,,,
s3963,Movie,15-Aug,India,3/29/2019,2019,TV-14,"Comedies, Dramas, Independent Movies",,,,,,,
s3964,Movie,Bayonet,"Mexico, Finland",3/29/2019,2019,TV-MA,"Dramas, International Movies, Sports Movies",,,,,,,
s3965,TV Show,Osmosis,France,3/29/2019,2019,TV-MA,"International TV Shows, TV Dramas, TV Mysteries",,,,,,,
s3966,TV Show,Santa Clarita Diet,United States,3/29/2019,2019,TV-MA,"TV Comedies, TV Horror, TV Thrillers",,,,,,,
s3967,Movie,The Highwaymen,United States,3/29/2019,2019,R,Dramas,,,,,,,
s3968,Movie,The Legend of Cocaine Island,United States,3/29/2019,2019,TV-MA,Documentaries,,,,,,,
s3969,TV Show,The Terminal,,3/29/2019,2018,TV-14,"International TV Shows, TV Dramas",,,,,,,
s3970,TV Show,Traitors,United Kingdom,3/29/2019,2019,TV-MA,"British TV Shows, International TV Shows, TV Dramas",,,,,,,
s3971,TV Show,Versailles,"France, Canada",3/29/2019,2018,TV-MA,"International TV Shows, TV Dramas",,,,,,,
s5967,Movie,15-Aug,India,3/29/2019,2019,TV-14,"Comedies, Dramas, Independent Movies",,,,,,,
s6320,TV Show,Bitter Daisies,Spain,3/29/2019,2018,TV-MA,"Crime TV Shows, International TV Shows, TV Dramas",,,,,,,
s8214,Movie,The Bleeder,United States,3/29/2019,2016,R,"Dramas, Sports Movies",,,,,,,
s8639,Movie,Tucker and Dale vs. Evil,"Canada, United States, India, United Kingdom",3/29/2019,2010,R,"Comedies, Horror Movies, Independent Movies",,,,,,,
s8755,Movie,Wolves,United States,3/29/2019,2016,R,"Dramas, Independent Movies, Sports Movies",,,,,,,
s3962,TV Show,Pablo,United Kingdom,3/30/2019,2017,TV-Y,"British TV Shows, Kids' TV",,,,,,,
s5975,TV Show,à¹à¸œà¸™à¸£à¹‰à¸²à¸¢à¸™à¸²à¸¢à¹€à¸ˆà¹‰à¸²à¹€à¸¥à¹ˆà¸«à¹Œ,,3/30/2019,2016,TV-14,"International TV Shows, Romantic TV Shows, TV Comedies",,,,,,,
s3960,Movie,Mercy Black,United States,3/31/2019,2019,TV-14,Horror Movies,,,,,,,
s3961,Movie,The Burial of Kojo,"Ghana, United States",3/31/2019,2018,TV-14,"Dramas, Independent Movies, International Movies",,,,,,,
s7376,TV Show,Maggie & Bianca: Fashion Friends,Italy,3/31/2019,2017,TV-Y7,"Kids' TV, TV Comedies",,,,,,,
s3954,TV Show,Kicko & Super Speedo,,4/1/2019,2018,TV-Y7,"Kids' TV, TV Comedies",,,,,,,
s3955,Movie,Love O2O,China,4/1/2019,2016,TV-14,"International Movies, Romantic Movies, Sci-Fi & Fantasy",,,,,,,
s3956,Movie,Pinky Memsaab,"Pakistan, United Arab Emirates",4/1/2019,2018,TV-MA,"Dramas, Independent Movies, International Movies",,,,,,,
s3957,TV Show,"That Winter, the Wind Blows",South Korea,4/1/2019,2013,TV-MA,"International TV Shows, Korean TV Shows, Romantic TV Shows",,,,,,,
s3958,Movie,The Trap,United States,4/1/2019,2017,TV-MA,Comedies,,,,,,,
s3959,TV Show,Ultraman,"United States, Japan",4/1/2019,2019,TV-14,"Anime Series, International TV Shows",,,,,,,
s5962,Movie,706,India,4/1/2019,2019,TV-14,"Horror Movies, International Movies",,,,,,,
s6085,Movie,Across The Line,Canada,4/1/2019,2015,TV-MA,"Dramas, Sports Movies",,,,,,,
s6146,Movie,American Masters: Ted Williams,United States,4/1/2019,2018,TV-MA,"Documentaries, Sports Movies",,,,,,,
s6186,Movie,Arthur,United States,4/1/2019,2011,PG-13,"Comedies, Romantic Movies",,,,,,,
s6794,Movie,Fracture,"United States, Germany",4/1/2019,2007,R,"Dramas, Thrillers",,,,,,,
s6843,Movie,Get Smart,United States,4/1/2019,2008,PG-13,"Action & Adventure, Comedies",,,,,,,
s6953,Movie,Hedgehogs,"United States, China",4/1/2019,2016,PG,Children & Family Movies,,,,,,,
s7039,Movie,I Am Maris,United States,4/1/2019,2018,TV-14,Documentaries,,,,,,,
s7128,Movie,Jesus: Countdown to Calvary,"Ireland, United States, France",4/1/2019,2018,TV-14,"Documentaries, Faith & Spirituality",,,,,,,
s7132,TV Show,JingleKids,Russia,4/1/2019,2017,TV-Y7,Kids' TV,,,,,,,
s7454,TV Show,Midnight Misadventures With Mallika Dua,India,4/1/2019,2018,TV-14,"International TV Shows, Stand-Up Comedy & Talk Shows, TV Comedies",,,,,,,
s7691,Movie,P.S. I Love You,United States,4/1/2019,2007,PG-13,"Dramas, Romantic Movies",,,,,,,
s7725,Movie,Penelope,"United Kingdom, United States",4/1/2019,2006,PG,"Children & Family Movies, Comedies, Romantic Movies",,,,,,,
s8075,Movie,Spy Kids,United States,4/1/2019,2001,PG,"Children & Family Movies, Comedies",,,,,,,
s8077,Movie,Spy Kids 3: Game Over,United States,4/1/2019,2003,PG,"Children & Family Movies, Comedies",,,,,,,
s8233,Movie,The Bye Bye Man,"United States, China",4/1/2019,2017,PG-13,"Horror Movies, Thrillers",,,,,,,
s8236,TV Show,The Calling,India,4/1/2019,2018,TV-MA,"International TV Shows, Reality TV",,,,,,,
s8278,TV Show,The Devil Is a Part-Timer!,Japan,4/1/2019,2013,TV-14,Anime Series,,,,,,,
s8392,Movie,The Legend of Michael Mishra,India,4/1/2019,2016,TV-14,"Comedies, Dramas, International Movies",,,,,,,
s8538,Movie,The Trust,United States,4/1/2019,2015,R,Thrillers,,,,,,,
s8566,Movie,The World's Most Wanted Animal,United Kingdom,4/1/2019,2018,TV-PG,Documentaries,,,,,,,
s8695,Movie,War,"United States, Canada",4/1/2019,2007,R,Action & Adventure,,,,,,,
s3951,Movie,Ek Ladki Ko Dekha Toh Aisa Laga,India,4/2/2019,2019,TV-14,"Comedies, Dramas, International Movies",,,,,,,
s3952,Movie,Jagat,Malaysia,4/2/2019,2015,TV-MA,"Dramas, International Movies",,,,,,,
s3953,Movie,Kevin Hart: Irresponsible,United States,4/2/2019,2019,TV-MA,Stand-Up Comedy,,,,,,,
s6368,Movie,Boy Bye,United States,4/2/2019,2016,TV-MA,"Comedies, Romantic Movies",,,,,,,
s3948,Movie,Ricardo Quevedo: Los amargados somos mÃ¡s,,4/3/2019,2019,TV-MA,Stand-Up Comedy,,,,,,,
s3949,Movie,Suzzanna: Buried Alive,Indonesia,4/3/2019,2018,TV-MA,"Horror Movies, International Movies",,,,,,,
s3950,TV Show,Tango,Lebanon,4/3/2019,2018,TV-14,"International TV Shows, Romantic TV Shows, TV Dramas",,,,,,,
s5991,Movie,14 Blades,"Hong Kong, China, Singapore",4/3/2019,2010,R,"Action & Adventure, International Movies",,,,,,,
s3947,TV Show,Possessed,South Korea,4/4/2019,2019,TV-MA,"Crime TV Shows, International TV Shows, Korean TV Shows",,,,,,,
s3936,Movie,Alien Warfare,United States,4/5/2019,2019,TV-MA,"Action & Adventure, Sci-Fi & Fantasy",,,,,,,
s3937,TV Show,Derek,United Kingdom,4/5/2019,2015,TV-MA,"British TV Shows, International TV Shows, TV Comedies",,,,,,,
s3938,TV Show,Imposters,United States,4/5/2019,2017,TV-MA,"Crime TV Shows, International TV Shows, TV Comedies",,,,,,,
s3939,TV Show,Our Planet,"United States, United Kingdom",4/5/2019,2019,TV-PG,"Docuseries, Science & Nature TV",,,,,,,
s3940,Movie,Petta,India,4/5/2019,2019,TV-14,"Action & Adventure, Comedies, Dramas",,,,,,,
s3941,TV Show,Quicksand,Sweden,4/5/2019,2019,TV-MA,"Crime TV Shows, International TV Shows, TV Dramas",,,,,,,
s3942,TV Show,Rimba Racer,Malaysia,4/5/2019,2017,TV-PG,Kids' TV,,,,,,,
s3943,TV Show,Roman Empire: Reign of Blood,"Canada, United States",4/5/2019,2019,TV-MA,Docuseries,,,,,,,
s3944,TV Show,Spirit: Riding Free,United States,4/5/2019,2019,TV-Y7,Kids' TV,,,,,,,
s3945,TV Show,Tijuana,Mexico,4/5/2019,2019,TV-MA,"Crime TV Shows, International TV Shows, Spanish-Language TV Shows",,,,,,,
s3946,Movie,Unicorn Store,United States,4/5/2019,2019,TV-14,"Comedies, Dramas, Independent Movies",,,,,,,
s6210,Movie,Backfire,United States,4/5/2019,2019,TV-MA,"Dramas, Independent Movies, Thrillers",,,,,,,
s7362,Movie,Lupt,India,4/5/2019,2018,TV-14,"Horror Movies, International Movies, Thrillers",,,,,,,
s7754,Movie,Playing Hard,"Canada, United States",4/5/2019,2018,TV-MA,"Documentaries, International Movies",,,,,,,
s8517,Movie,The Spy Who Fell to Earth,United Kingdom,4/5/2019,2019,TV-MA,"Documentaries, International Movies",,,,,,,
s7812,Movie,Queen of the Desert,"United States, Morocco",4/6/2019,2015,PG-13,Dramas,,,,,,,
s3934,Movie,Petta (Telugu Version),,4/7/2019,2019,TV-14,"Action & Adventure, Comedies, Dramas",,,,,,,
s3935,TV Show,Time: The Kalief Browder Story,United States,4/7/2019,2017,TV-MA,Docuseries,,,,,,,
s3933,Movie,Sarvam Thaala Mayam (Telugu Version),India,4/8/2019,2018,TV-14,"Dramas, International Movies, Music & Musicals",,,,,,,
s8331,Movie,The Great Battle,South Korea,4/8/2019,2018,TV-MA,"Action & Adventure, Dramas, International Movies",,,,,,,
s7516,Movie,Movie 43,United States,4/9/2019,2013,R,Comedies,,,,,,,
s8205,Movie,The Basement,United States,4/9/2019,2018,TV-MA,"Horror Movies, Thrillers",,,,,,,
s3930,Movie,Liss Pereira: Reteniendo lÃ­quidos,Brazil,4/10/2019,2019,TV-14,Stand-Up Comedy,,,,,,,
s3931,Movie,The Silence,"Canada, Germany",4/10/2019,2019,PG-13,"Horror Movies, Thrillers",,,,,,,
s3932,TV Show,You vs. Wild,United States,4/10/2019,2019,TV-PG,"Kids' TV, Reality TV, Science & Nature TV",,,,,,,
s5974,Movie,#Roxy,Canada,4/10/2019,2018,TV-14,"Comedies, Romantic Movies",,,,,,,
s3928,TV Show,New Girl,United States,4/11/2019,2018,TV-14,"Romantic TV Shows, TV Comedies",,,,,,,
s3929,TV Show,Persona,South Korea,4/11/2019,2019,TV-MA,"International TV Shows, Korean TV Shows, TV Dramas",,,,,,,
s3923,Movie,Dabbe 5: Zehr-i Cin,Turkey,4/12/2019,2014,TV-MA,"Horror Movies, International Movies",,,,,,,
s3924,Movie,Dabbe: The Possession,Turkey,4/12/2019,2013,TV-MA,"Horror Movies, International Movies",,,,,,,
s3925,Movie,Francesco De Carlo: Cose di Questo Mondo,Italy,4/12/2019,2019,TV-MA,Stand-Up Comedy,,,,,,,
s3926,TV Show,Huge in France,United States,4/12/2019,2019,TV-MA,TV Comedies,,,,,,,
s3927,Movie,The Perfect Date,United States,4/12/2019,2019,TV-14,"Comedies, Romantic Movies",,,,,,,
s6203,Movie,Azhar,India,4/12/2019,2016,TV-14,"Dramas, International Movies, Sports Movies",,,,,,,
s6226,Movie,Band Aid,United States,4/12/2019,2017,R,"Comedies, Dramas, Independent Movies",,,,,,,
s6387,Movie,Buffalo Boys,"Indonesia, Singapore",4/12/2019,2018,TV-MA,"Action & Adventure, International Movies",,,,,,,
s7000,Movie,Horror Story,India,4/12/2019,2013,TV-14,"Horror Movies, International Movies",,,,,,,
s3921,TV Show,Crazy Ex-Girlfriend,United States,4/13/2019,2019,TV-MA,"Romantic TV Shows, TV Comedies",,,,,,,
s3922,Movie,Who Would You Take to a Deserted Island?,Spain,4/13/2019,2019,TV-MA,"Dramas, International Movies",,,,,,,
s3920,Movie,Thriller,United States,4/14/2019,2018,TV-MA,Horror Movies,,,,,,,
s6176,Movie,Antidote,United States,4/14/2019,2018,TV-MA,"Action & Adventure, Horror Movies",,,,,,,
s3911,Movie,Bollywood Calling,India,4/15/2019,2001,TV-MA,"Comedies, Dramas, International Movies",,,,,,,
s3912,Movie,Ek Khiladi Ek Haseena,India,4/15/2019,2005,TV-14,"International Movies, Music & Musicals, Thrillers",,,,,,,
s3913,Movie,Generation Iron 3,United States,4/15/2019,2018,TV-MA,"Documentaries, Sports Movies",,,,,,,
s3914,Movie,Hazaaron Khwaishein Aisi,"India, France",4/15/2019,2003,TV-MA,"Dramas, International Movies, Romantic Movies",,,,,,,
s3915,Movie,Jhankaar Beats,India,4/15/2019,2003,TV-14,"Comedies, International Movies, Music & Musicals",,,,,,,
s3916,Movie,Mumbai Matinee,India,4/15/2019,2003,TV-14,"Comedies, International Movies, Romantic Movies",,,,,,,
s3917,Movie,Rainbow Jelly,India,4/15/2019,2018,TV-14,"Dramas, International Movies, Sci-Fi & Fantasy",,,,,,,
s3918,Movie,Shabd,India,4/15/2019,2005,TV-14,"Dramas, International Movies, Romantic Movies",,,,,,,
s3919,Movie,Shortcut Safari,India,4/15/2019,2016,TV-PG,"Action & Adventure, Comedies, Dramas",,,,,,,
s8439,Movie,The New Romantic,Canada,4/15/2019,2018,TV-MA,"Comedies, Independent Movies, Romantic Movies",,,,,,,
s3909,Movie,About Time,United Kingdom,4/16/2019,2013,R,"Comedies, Dramas, International Movies",,,,,,,
s3910,Movie,Super Monsters Furever Friends,,4/16/2019,2019,TV-Y,Children & Family Movies,,,,,,,
s6001,Movie,21 & Over,United States,4/16/2019,2013,R,Comedies,,,,,,,
s6711,Movie,Evan Almighty,United States,4/16/2019,2007,PG,"Children & Family Movies, Comedies, Faith & Spirituality",,,,,,,
s7140,Movie,Jonathan,United States,4/16/2019,2018,TV-MA,"Dramas, Independent Movies, Sci-Fi & Fantasy",,,,,,,
s7522,TV Show,Mr. Young,Canada,4/16/2019,2013,TV-G,"Kids' TV, TV Comedies",,,,,,,
s3906,Movie,A Little Chaos,United Kingdom,4/17/2019,2014,R,"Dramas, Independent Movies, International Movies",,,,,,,
s3907,Movie,Franco Escamilla: Bienvenido al mundo,Mexico,4/17/2019,2019,TV-MA,Stand-Up Comedy,,,,,,,
s3908,Movie,HOMECOMING: A film by BeyoncÃ©,,4/17/2019,2019,TV-MA,"Documentaries, Music & Musicals",,,,,,,
s6548,Movie,Dabbe 6: The Return,Turkey,4/17/2019,2015,TV-MA,"Horror Movies, International Movies",,,,,,,
s6575,Movie,De Film van Dylan Haegens,Netherlands,4/17/2019,2018,TV-PG,"Comedies, International Movies",,,,,,,
s6012,Movie,30 Days of Luxury,Egypt,4/18/2019,2016,TV-14,"Comedies, International Movies",,,,,,,
s6270,Movie,Because We're Heading Out,Egypt,4/18/2019,2016,TV-14,"Comedies, International Movies",,,,,,,
s7535,Movie,My Dog is My Guide,Egypt,4/18/2019,2013,TV-14,"Comedies, International Movies",,,,,,,
s7551,Movie,My Wife and My Wifey,,4/18/2019,2014,TV-14,"Comedies, International Movies",,,,,,,
s8551,Movie,The Walls of the Moon,Egypt,4/18/2019,2015,TV-14,"Action & Adventure, Dramas, International Movies",,,,,,,
s8699,Movie,Warda,Egypt,4/18/2019,2014,TV-14,"Horror Movies, Independent Movies, International Movies",,,,,,,
s3897,Movie,BrenÃ© Brown: The Call to Courage,,4/19/2019,2019,TV-14,Documentaries,,,,,,,
