show_id,type,title,country,date_added,release_year,rating,listed_in,Date,Open,High,Low,Close,Adj_close,Volume
s8289,Movie,The End of the Tour,United States,7/26/2018,2015,R,"Dramas, Independent Movies",,,,,,,
s4750,Movie,Coco y Raulito: Carrusel de ternura,Mexico,7/27/2018,2018,TV-MA,Stand-Up Comedy,,,,,,,
s4751,TV Show,El Chapo,"Mexico, United States",7/27/2018,2018,TV-MA,"Crime TV Shows, Spanish-Language TV Shows, TV Action & Adventure",,,,,,,
s4752,Movie,Extinction,United States,7/27/2018,2018,TV-MA,"Action & Adventure, Dramas, Sci-Fi & Fantasy",,,,,,,
s4753,TV Show,Smoking,Japan,7/27/2018,2018,TV-MA,"Crime TV Shows, International TV Shows, TV Action & Adventure",,,,,,,
s4754,Movie,The Bleeding Edge,"Australia, United States",7/27/2018,2018,TV-14,Documentaries,,,,,,,
s4755,TV Show,Welcome to the Family,Spain,7/27/2018,2018,TV-MA,"International TV Shows, TV Comedies, TV Dramas",,,,,,,
s4746,Movie,Da Kath & Kim Code,Australia,7/28/2018,2005,TV-PG,Movies,,,,,,,
s4747,Movie,Kath & Kimderella,Australia,7/28/2018,2012,TV-14,Comedies,,,,,,,
s4748,TV Show,Kath and Kim,Australia,7/28/2018,2007,TV-MA,TV Comedies,,,,,,,
s4749,Movie,The Mansion,"France, Belgium",7/28/2018,2017,TV-MA,"Comedies, Horror Movies, International Movies",,,,,,,
s8252,Movie,The Company Men,United States,7/28/2018,2010,R,"Dramas, Independent Movies",,,,,,,
s8307,Movie,The Flying Guillotine,Hong Kong,7/28/2018,1975,TV-MA,"Action & Adventure, Dramas, International Movies",,,,,,,
s6959,Movie,Her,United States,7/29/2018,2013,R,"Dramas, Romantic Movies, Sci-Fi & Fantasy",,,,,,,
s4744,TV Show,A Very Secret Service,France,7/30/2018,2018,TV-MA,"International TV Shows, TV Comedies",,,,,,,
s4745,TV Show,SWORDGAI The Animation,Japan,7/30/2018,2018,TV-MA,"Anime Series, International TV Shows",,,,,,,
s6987,Movie,Holy Man 2,Thailand,7/30/2018,2008,TV-14,"Comedies, Faith & Spirituality, International Movies",,,,,,,
s6988,Movie,Holy Man 3,Thailand,7/30/2018,2010,TV-MA,"Comedies, Faith & Spirituality, International Movies",,,,,,,
s8544,Movie,The Unborn Child,Thailand,7/30/2018,2011,TV-MA,"Horror Movies, International Movies",,,,,,,
s6772,Movie,Flying Guillotine 2,Hong Kong,7/31/2018,1978,TV-MA,"Action & Adventure, International Movies",,,,,,,
s7839,TV Show,Reality of Dream,,7/31/2018,2015,TV-MA,"International TV Shows, Romantic TV Shows, TV Dramas",,,,,,,
s8304,Movie,The Five Venoms,Hong Kong,7/31/2018,1978,R,"Action & Adventure, Cult Movies, International Movies",,,,,,,
s4739,TV Show,Becoming Champions,Mexico,8/1/2018,2018,TV-G,"Docuseries, International TV Shows",,,,,,,
s4740,Movie,Being Napoleon,United States,8/1/2018,2018,TV-MA,Documentaries,,,,,,,
s4741,Movie,Invisible,"Argentina, France",8/1/2018,2017,TV-MA,"Dramas, Independent Movies, International Movies",,,,,,,
s4742,TV Show,Switched,Japan,8/1/2018,2018,TV-MA,"International TV Shows, TV Dramas, TV Mysteries",,,,,,,
s4743,TV Show,The Couldâ€™ve-Gone-All-the-Way Committee,Japan,8/1/2018,2018,TV-14,"International TV Shows, Romantic TV Shows, TV Dramas",,,,,,,
s6261,Movie,Bean: The Ultimate Disaster Movie,"United Kingdom, United States",8/1/2018,1997,PG-13,"Comedies, International Movies",,,,,,,
s6429,Movie,Casino Tycoon,Hong Kong,8/1/2018,1992,TV-MA,"Action & Adventure, Dramas, International Movies",,,,,,,
s6459,Movie,Chernobyl Diaries,United States,8/1/2018,2012,R,"Horror Movies, Thrillers",,,,,,,
s6637,Movie,Doubles Cause Troubles,Hong Kong,8/1/2018,1989,TV-14,"Action & Adventure, Comedies, International Movies",,,,,,,
s6770,Movie,Flock of Four,United States,8/1/2018,2018,TV-MA,"Dramas, Independent Movies, Music & Musicals",,,,,,,
s6963,Movie,Hero,"Hong Kong, China",8/1/2018,1997,TV-MA,"Action & Adventure, International Movies",,,,,,,
s6976,Movie,History of Joy,India,8/1/2018,2017,TV-14,"Dramas, International Movies",,,,,,,
s7162,Movie,Kaaliyan,India,8/1/2018,2017,TV-PG,"Dramas, International Movies",,,,,,,
s7241,Movie,Kung Fu Magoo,"Mexico, United States",8/1/2018,2010,TV-Y7,"Children & Family Movies, Comedies",,,,,,,
s7244,Movie,Kuppivala,,8/1/2018,2017,TV-14,"Dramas, International Movies, Romantic Movies",,,,,,,
s7281,Movie,Lechmi,India,8/1/2018,2017,TV-MA,"Comedies, Horror Movies, International Movies",,,,,,,
s7312,Movie,Little Dragon Maiden,Hong Kong,8/1/2018,1983,TV-14,"Action & Adventure, International Movies, Romantic Movies",,,,,,,
s7341,TV Show,Los tiempos de Pablo Escobar,Colombia,8/1/2018,2012,TV-14,"Crime TV Shows, Docuseries, International TV Shows",,,,,,,
s7346,Movie,Love In A Puff,Hong Kong,8/1/2018,2010,TV-MA,"Comedies, Dramas, International Movies",,,,,,,
s7381,Movie,Mahabharat,India,8/1/2018,2013,TV-14,"Action & Adventure, Dramas, International Movies",,,,,,,
s7422,Movie,Mater,Argentina,8/1/2018,2017,TV-MA,"Dramas, Independent Movies, International Movies",,,,,,,
s7438,Movie,Melle,India,8/1/2018,2017,TV-PG,"Dramas, International Movies, Romantic Movies",,,,,,,
s7459,Movie,Minnaminugu the FireFly,India,8/1/2018,2017,TV-14,"Dramas, International Movies",,,,,,,
s7553,Movie,Mythily Veendum Varunnu,India,8/1/2018,2017,TV-PG,"Horror Movies, International Movies",,,,,,,
s7655,Movie,Once In A Lifetime Sessions with Moby,United States,8/1/2018,2018,TV-14,"Documentaries, Music & Musicals",,,,,,,
s7656,Movie,Once In A Lifetime Sessions with Nile Rodgers,United States,8/1/2018,2018,TV-PG,"Documentaries, Music & Musicals",,,,,,,
s7657,Movie,Once In A Lifetime Sessions with Noel Gallagher,United States,8/1/2018,2018,TV-MA,"Documentaries, Music & Musicals",,,,,,,
s7658,Movie,Once In A Lifetime Sessions with TLC,United States,8/1/2018,2018,TV-PG,"Documentaries, Music & Musicals",,,,,,,
s7681,Movie,Oru Vishsheshapetta Biryani Kissa,India,8/1/2018,2017,TV-14,"Comedies, Dramas, International Movies",,,,,,,
s7689,Movie,P Se PM Tak,India,8/1/2018,2015,TV-14,"Comedies, Independent Movies, International Movies",,,,,,,
s7815,Movie,R.L. Stine's Mostly Ghostly,United States,8/1/2018,2008,PG,"Children & Family Movies, Comedies",,,,,,,
s7834,Movie,Rangreza,Pakistan,8/1/2018,2017,TV-14,"Dramas, International Movies, Music & Musicals",,,,,,,
s8115,Movie,Sudani from Nigeria,India,8/1/2018,2018,TV-14,"Comedies, Dramas, International Movies",,,,,,,
s8280,Movie,The Diabolical,United States,8/1/2018,2015,TV-MA,"Horror Movies, Sci-Fi & Fantasy, Thrillers",,,,,,,
s8363,Movie,The Informant!,United States,8/1/2018,2009,R,"Comedies, Dramas",,,,,,,
s8447,Movie,The Parole Officer,United Kingdom,8/1/2018,2001,R,"Action & Adventure, Comedies",,,,,,,
s8591,Movie,Tikli and Laxmi Bomb,India,8/1/2018,2017,TV-MA,"Dramas, International Movies",,,,,,,
s4720,Movie,7 Khoon Maaf,India,8/2/2018,2011,TV-MA,"Dramas, International Movies, Thrillers",,,,,,,
s4721,Movie,Chillar Party,India,8/2/2018,2011,TV-PG,"Children & Family Movies, Comedies, Dramas",,,,,,,
s4722,Movie,Fashion,India,8/2/2018,2008,TV-MA,"Dramas, International Movies",,,,,,,
s4723,Movie,Fitoor,India,8/2/2018,2016,TV-14,"Dramas, International Movies, Romantic Movies",,,,,,,
s4724,Movie,Fiza,India,8/2/2018,2000,TV-14,"Dramas, International Movies, Music & Musicals",,,,,,,
s4725,Movie,Guzaarish,India,8/2/2018,2010,TV-14,"Dramas, International Movies",,,,,,,
s4726,Movie,Haider,India,8/2/2018,2014,TV-MA,"Dramas, International Movies, Romantic Movies",,,,,,,
s4727,Movie,Highway,India,8/2/2018,2014,TV-14,"Action & Adventure, Dramas, International Movies",,,,,,,
s4728,Movie,I Hate Luv Storys,India,8/2/2018,2010,TV-14,"Comedies, International Movies, Music & Musicals",,,,,,,
s4729,Movie,Joker,India,8/2/2018,2012,TV-PG,"Comedies, International Movies, Music & Musicals",,,,,,,
s4730,Movie,Main aurr Mrs. Khanna,India,8/2/2018,2009,TV-14,"International Movies, Music & Musicals, Romantic Movies",,,,,,,
s4731,Movie,Mohenjo Daro,India,8/2/2018,2016,TV-14,"Action & Adventure, Dramas, International Movies",,,,,,,
s4732,Movie,Raajneeti,India,8/2/2018,2010,TV-14,"Dramas, International Movies, Thrillers",,,,,,,
s4733,Movie,Rang De Basanti,India,8/2/2018,2006,TV-14,"Dramas, International Movies",,,,,,,
s4734,Movie,Rowdy Rathore,India,8/2/2018,2012,TV-14,"Action & Adventure, Comedies, International Movies",,,,,,,
s4735,Movie,Tamasha,India,8/2/2018,2015,TV-14,"Dramas, International Movies, Romantic Movies",,,,,,,
s4736,Movie,Tere Naal Love Ho Gaya,India,8/2/2018,2012,TV-14,"Comedies, International Movies, Romantic Movies",,,,,,,
s4737,Movie,Thank You,India,8/2/2018,2011,TV-14,"Comedies, International Movies, Romantic Movies",,,,,,,
s4738,Movie,The Blue Umbrella,India,8/2/2018,2005,TV-PG,"Children & Family Movies, Dramas, Independent Movies",,,,,,,
s6527,Movie,Concussion,United States,8/2/2018,2013,R,"Dramas, Independent Movies, LGBTQ Movies",,,,,,,
s6688,Movie,Emelie,United States,8/2/2018,2016,TV-MA,"Horror Movies, Thrillers",,,,,,,
s6787,Movie,Forever Chape,Brazil,8/2/2018,2018,TV-MA,"Documentaries, International Movies, Sports Movies",,,,,,,
s7187,Movie,Khosla Ka Ghosla,India,8/2/2018,2006,TV-14,"Comedies, Dramas, International Movies",,,,,,,
s7652,Movie,On the Wrong Track,Hong Kong,8/2/2018,1983,TV-14,"Action & Adventure, International Movies",,,,,,,
s8162,Movie,Tees Maar Khan,India,8/2/2018,2010,TV-PG,"Comedies, International Movies, Music & Musicals",,,,,,,
s4717,TV Show,Cocaine Coast,Spain,8/3/2018,2018,TV-MA,"Crime TV Shows, International TV Shows, Spanish-Language TV Shows",,,,,,,
s4718,TV Show,Dinotrux Supercharged,,8/3/2018,2018,TV-Y7,Kids' TV,,,,,,,
s4719,Movie,Like Father,United States,8/3/2018,2018,TV-MA,"Comedies, Dramas",,,,,,,
s7405,TV Show,Marching Orders,United States,8/3/2018,2018,TV-14,Docuseries,,,,,,,
s4713,Movie,2 States,India,8/4/2018,2014,TV-PG,"Comedies, Dramas, International Movies",,,,,,,
s4714,Movie,Baaghi,India,8/4/2018,2016,TV-14,"Action & Adventure, International Movies",,,,,,,
s4715,Movie,Brij Mohan Amar Rahe,India,8/4/2018,2018,TV-MA,"Comedies, Dramas, International Movies",,,,,,,
s4716,Movie,Flavors of Youth: International Version,"China, Japan",8/4/2018,2018,TV-PG,"Anime Features, International Movies, Romantic Movies",,,,,,,
s4712,TV Show,On Children,Taiwan,8/5/2018,2018,TV-14,"International TV Shows, TV Dramas, TV Mysteries",,,,,,,
s4711,TV Show,Pretty Man,,8/8/2018,2018,TV-14,"International TV Shows, Romantic TV Shows, TV Dramas",,,,,,,
s6698,TV Show,Enemigo Ã­ntimo,,8/8/2018,2018,TV-MA,"Crime TV Shows, Spanish-Language TV Shows, TV Dramas",,,,,,,
s4709,Movie,Perdida,"Argentina, Spain",8/9/2018,2018,TV-MA,"Dramas, International Movies, Thrillers",,,,,,,
s4710,TV Show,The Originals,United States,8/9/2018,2018,TV-14,"TV Dramas, TV Horror, TV Mysteries",,,,,,,
s4703,TV Show,72 Dangerous Animals: Asia,Australia,8/10/2018,2018,TV-14,"Docuseries, International TV Shows, Science & Nature TV",,,,,,,
s4704,TV Show,Afflicted,United States,8/10/2018,2018,TV-MA,"Docuseries, Reality TV, Science & Nature TV",,,,,,,
s4705,TV Show,All About the Washingtons,United States,8/10/2018,2018,TV-PG,TV Comedies,,,,,,,
s4706,Movie,The Guernsey Literary and Potato Peel Pie Society,"United Kingdom, France, United States",8/10/2018,2018,TV-PG,"Dramas, Romantic Movies",,,,,,,
s4707,Movie,The Package,United States,8/10/2018,2018,TV-MA,Comedies,,,,,,,
s4708,Movie,Zion,United States,8/10/2018,2018,TV-PG,"Documentaries, Sports Movies",,,,,,,
s6294,Movie,Beyond the Clouds,"India, Iran",8/10/2018,2018,TV-14,"Dramas, Independent Movies, International Movies",,,,,,,
s8071,TV Show,Splash and Bubbles,United States,8/13/2018,2018,TV-Y,Kids' TV,,,,,,,
s4702,Movie,For Here or to Go?,"United States, India",8/15/2018,2015,TV-MA,"Comedies, Dramas, Independent Movies",,,,,,,
s6094,Movie,Adventures in Public School,"Canada, United States",8/15/2018,2018,NR,Comedies,,,,,,,
s6315,Movie,Bioscope,India,8/15/2018,2015,TV-14,"Dramas, International Movies, LGBTQ Movies",,,,,,,
s7003,Movie,Hostiles,United States,8/15/2018,2017,R,Dramas,,,,,,,
s7032,Movie,Hurricane Bianca: From Russia With Hate,United States,8/15/2018,2018,TV-MA,"Comedies, Independent Movies, LGBTQ Movies",,,,,,,
s7625,TV Show,Nuestra Lucha Libre,,8/15/2018,2018,TV-MA,"Docuseries, International TV Shows, Spanish-Language TV Shows",,,,,,,
s4701,Movie,Bhavesh Joshi Superhero,India,8/16/2018,2018,TV-14,"Dramas, International Movies, Sci-Fi & Fantasy",,,,,,,
s6430,Movie,Casino Tycoon 2,Hong Kong,8/16/2018,1992,TV-MA,"Action & Adventure, Dramas, International Movies",,,,,,,
s6615,Movie,Disciples Of The 36th Chamber,Hong Kong,8/16/2018,1985,TV-14,"Action & Adventure, International Movies",,,,,,,
s7285,Movie,Legendary Weapons of China,Hong Kong,8/16/2018,1982,TV-14,"Action & Adventure, Cult Movies, International Movies",,,,,,,
s7304,Movie,Lifeline,Hong Kong,8/16/2018,1997,TV-14,"Action & Adventure, International Movies",,,,,,,
s7336,Movie,"Look Out, Officer",Hong Kong,8/16/2018,1990,TV-14,"Action & Adventure, Comedies, International Movies",,,,,,,
s7348,Movie,Love on Delivery,Hong Kong,8/16/2018,1994,TV-14,"Action & Adventure, Comedies, International Movies",,,,,,,
s7358,Movie,Loving You,Hong Kong,8/16/2018,1995,TV-14,"Dramas, International Movies",,,,,,,
s7385,Movie,Mahjong Heroes,Hong Kong,8/16/2018,1981,TV-PG,"Comedies, International Movies",,,,,,,
s7411,Movie,Martial Arts of Shaolin,"Hong Kong, China",8/16/2018,1986,R,"Action & Adventure, International Movies",,,,,,,
s7520,Movie,Mr. Virgin,Hong Kong,8/16/2018,1984,TV-14,"Comedies, Dramas, International Movies",,,,,,,
s7545,Movie,"My Schoolmate, the Barbarian",Hong Kong,8/16/2018,2001,TV-14,"Action & Adventure, Comedies, International Movies",,,,,,,
s7645,Movie,Oh My Ghost 3,Thailand,8/16/2018,2012,TV-MA,"Comedies, Horror Movies, International Movies",,,,,,,
s7679,Movie,Opium and the Kung Fu Master,Hong Kong,8/16/2018,1984,TV-MA,"Action & Adventure, International Movies",,,,,,,
s7698,Movie,Painted Faces,Hong Kong,8/16/2018,1988,TV-PG,"Dramas, International Movies",,,,,,,
s7861,Movie,Return To The 36th Chamber,Hong Kong,8/16/2018,1980,R,"Action & Adventure, Comedies, International Movies",,,,,,,
s7998,Movie,Shark Busters,Hong Kong,8/16/2018,2002,TV-14,"Dramas, International Movies",,,,,,,
s8143,Movie,Sword Masters: Two Champions of Shaolin,Hong Kong,8/16/2018,1980,R,"Action & Adventure, International Movies",,,,,,,
s8204,Movie,The Bare-Footed Kid,Hong Kong,8/16/2018,1993,TV-14,"Action & Adventure, International Movies",,,,,,,
s8410,Movie,The Mad Monk,Hong Kong,8/16/2018,1993,TV-14,"Comedies, International Movies, Sci-Fi & Fantasy",,,,,,,
s8570,Movie,The Young Vagabond,Hong Kong,8/16/2018,1985,TV-14,"Action & Adventure, Comedies, International Movies",,,,,,,
s8752,Movie,Wish I Was Here,United States,8/16/2018,2014,R,"Comedies, Dramas, Independent Movies",,,,,,,
s4696,Movie,Party Monster: Scratching the Surface,United States,8/17/2018,2018,TV-14,Comedies,,,,,,,
s4697,TV Show,Stay Here,United States,8/17/2018,2018,TV-PG,Reality TV,,,,,,,
s4698,Movie,The Motive,"Spain, Mexico",8/17/2018,2017,TV-MA,"Comedies, Dramas, International Movies",,,,,,,
s4699,Movie,To All the Boys Iâ€™ve Loved Before,United States,8/17/2018,2018,TV-14,"Comedies, International Movies, Romantic Movies",,,,,,,
s4700,Movie,Yoo Byung Jae: Discomfort Zone,South Korea,8/17/2018,2018,TV-MA,Stand-Up Comedy,,,,,,,
s6111,Movie,Alejandro Sanz: What I Was Is What I Am,Spain,8/18/2018,2018,TV-MA,"Documentaries, International Movies, Music & Musicals",,,,,,,
s7733,Movie,Peter Rabbit,"United States, Australia",8/18/2018,2018,PG,"Children & Family Movies, Comedies",,,,,,,
s7949,TV Show,Save Our Shelter,United States,8/18/2018,2015,TV-G,Reality TV,,,,,,,
s6197,Movie,Attitude Test,Chile,8/19/2018,2016,TV-14,"Comedies, Independent Movies, International Movies",,,,,,,
s6246,Movie,Barrio Universitario,Chile,8/19/2018,2013,TV-14,"Comedies, International Movies",,,,,,,
s6904,Movie,HÃ©roes,Chile,8/19/2018,2015,TV-MA,"Comedies, International Movies",,,,,,,
s7292,TV Show,Leo & Tig,,8/20/2018,2017,TV-Y,Kids' TV,,,,,,,
s4691,Movie,Bareilly Ki Barfi,India,8/21/2018,2017,TV-14,"Comedies, Dramas, International Movies",,,,,,,
s4692,Movie,Mersal,India,8/21/2018,2017,TV-14,"Action & Adventure, Dramas, International Movies",,,,,,,
s4693,Movie,Mom,India,8/21/2018,2017,TV-14,"Dramas, International Movies, Thrillers",,,,,,,
s4694,Movie,Pad Man,India,8/21/2018,2018,PG-13,"Dramas, International Movies, Romantic Movies",,,,,,,
s4695,Movie,Toilet: Ek Prem Katha,India,8/21/2018,2017,TV-14,"Comedies, Dramas, International Movies",,,,,,,
s6681,Movie,Elephants Dream 4 Hour,Netherlands,8/23/2018,2006,TV-MA,"International Movies, Sci-Fi & Fantasy",,,,,,,
s8400,Movie,The Lodgers,Ireland,8/23/2018,2017,R,"Horror Movies, International Movies",,,,,,,
s4685,Movie,Bert Kreischer: Secret Time,,8/24/2018,2018,TV-MA,Stand-Up Comedy,,,,,,,
s4686,TV Show,GHOUL,India,8/24/2018,2018,TV-MA,"International TV Shows, TV Dramas, TV Horror",,,,,,,
s4687,Movie,One Last Shot,Canada,8/24/2018,1998,TV-MA,Comedies,,,,,,,
s4688,TV Show,Take My Brother Away,China,8/24/2018,2018,TV-14,"International TV Shows, TV Comedies, TV Dramas",,,,,,,
s4689,Movie,The After Party,United States,8/24/2018,2018,TV-MA,"Comedies, Music & Musicals",,,,,,,
s4690,TV Show,The Innocents,United Kingdom,8/24/2018,2018,TV-MA,"British TV Shows, International TV Shows, Romantic TV Shows",,,,,,,
s6673,TV Show,El Cartel,Colombia,8/24/2018,2008,TV-MA,"Crime TV Shows, International TV Shows, Spanish-Language TV Shows",,,,,,,
s6674,TV Show,El Cartel 2,Colombia,8/24/2018,2010,TV-MA,"Crime TV Shows, International TV Shows, Spanish-Language TV Shows",,,,,,,
s8283,TV Show,The Drunk and on Drugs Happy Funtime Hour,Canada,8/24/2018,2011,TV-MA,"International TV Shows, TV Comedies",,,,,,,
s8463,Movie,The Power of Grayskull: The Definitive History of He-Man and the Masters of the Universe,"Canada, United States",8/24/2018,2017,TV-14,Documentaries,,,,,,,
s4684,Movie,Maria Bamford: The Special Special Special,United States,8/25/2018,2012,TV-MA,Stand-Up Comedy,,,,,,,
s6917,Movie,Hank: Five Years from the Brink,United States,8/25/2018,2013,TV-14,Documentaries,,,,,,,
s6948,Movie,Head On,Australia,8/25/2018,1998,TV-MA,"Dramas, Independent Movies, LGBTQ Movies",,,,,,,
s7632,Movie,Nymphomaniac: Volume II,"Denmark, Germany, Belgium, United Kingdom, France, Sweden",8/25/2018,2013,TV-MA,"Dramas, Independent Movies, International Movies",,,,,,,
s7425,Movie,May We Chat,Hong Kong,8/26/2018,2014,TV-MA,"Dramas, International Movies",,,,,,,
s4683,TV Show,Chicken Soup for the Soul's Being Dad,United States,8/27/2018,2018,TV-MA,Docuseries,,,,,,,
s6044,Movie,A Leaf of Faith,United States,8/27/2018,2018,TV-MA,Documentaries,,,,,,,
s4680,Movie,Naam Shabana,India,8/28/2018,2017,TV-14,"Action & Adventure, International Movies",,,,,,,
s4681,Movie,Qarib Qarib Singlle,India,8/28/2018,2017,TV-14,"Comedies, International Movies, Romantic Movies",,,,,,,
s4682,Movie,Spyder,India,8/28/2018,2017,TV-14,"Action & Adventure, International Movies",,,,,,,
s6528,Movie,Conjuring Spirit,Vietnam,8/28/2018,2014,TV-MA,"Horror Movies, International Movies, Thrillers",,,,,,,
s6259,TV Show,Be-Be-Bears,Russia,8/29/2018,2018,TV-Y,Kids' TV,,,,,,,
s7076,Movie,Inequality for All,United States,8/29/2018,2013,PG,Documentaries,,,,,,,
s8525,Movie,The Surrounding Game,United States,8/30/2018,2018,TV-14,Documentaries,,,,,,,
s4673,TV Show,Cathedral of the Sea,Spain,8/31/2018,2017,TV-MA,"International TV Shows, Spanish-Language TV Shows, TV Dramas",,,,,,,
s4674,TV Show,Inside the Criminal Mind,"United States, Czech Republic",8/31/2018,2018,TV-MA,"Crime TV Shows, Docuseries, International TV Shows",,,,,,,
s4675,TV Show,The Comedy Lineup,United States,8/31/2018,2018,TV-MA,"Stand-Up Comedy & Talk Shows, TV Comedies",,,,,,,
s4676,Movie,The Laws of Thermodynamics,Spain,8/31/2018,2018,TV-MA,"Comedies, International Movies, Romantic Movies",,,,,,,
s4677,TV Show,Ultimate Beastmaster,"United States, Brazil, South Korea, Mexico, Japan, Germany",8/31/2018,2018,TV-PG,Reality TV,,,,,,,
s4678,TV Show,Ultimate Beastmaster MÃ©xico,,8/31/2018,2018,TV-PG,"Reality TV, Spanish-Language TV Shows",,,,,,,
s4679,TV Show,Undercover Law,Colombia,8/31/2018,2017,TV-MA,"Crime TV Shows, International TV Shows, Spanish-Language TV Shows",,,,,,,
s7154,Movie,"Justice, My Foot!",Hong Kong,8/31/2018,1992,TV-14,"Action & Adventure, Comedies, International Movies",,,,,,,
s7795,Movie,Prince Charming,Hong Kong,8/31/2018,1984,TV-14,"Comedies, International Movies, Romantic Movies",,,,,,,
s8776,TV Show,Yeh Meri Family,India,8/31/2018,2018,TV-PG,"International TV Shows, TV Comedies",,,,,,,
s4665,TV Show,Age of Rebellion,Taiwan,9/1/2018,2018,TV-MA,"Crime TV Shows, International TV Shows, TV Dramas",,,,,,,
s4666,Movie,Carbon,"France, Belgium",9/1/2018,2017,TV-MA,"Dramas, International Movies, Thrillers",,,,,,,
s4667,Movie,Garbage,India,9/1/2018,2018,TV-MA,"Dramas, Independent Movies, International Movies",,,,,,,
s4668,Movie,â€‹â€‹Kuch Bheege Alfaaz,India,9/1/2018,2018,TV-14,"Dramas, Independent Movies, International Movies",,,,,,,
s4669,Movie,Love and Shukla,India,9/1/2018,2017,TV-MA,"Dramas, Independent Movies, International Movies",,,,,,,
s4670,Movie,Once Again,"India, Germany, Austria",9/1/2018,2018,TV-PG,"Dramas, Independent Movies, International Movies",,,,,,,
s4671,TV Show,Sisters,Australia,9/1/2018,2018,TV-MA,"International TV Shows, TV Comedies, TV Dramas",,,,,,,
s4672,Movie,Sparring,France,9/1/2018,2017,TV-MA,"Dramas, International Movies, Sports Movies",,,,,,,
s6232,Movie,BarÃ§a Dreams,Spain,9/1/2018,2015,TV-MA,"Documentaries, International Movies, Sports Movies",,,,,,,
s6377,Movie,Brick,United States,9/1/2018,2005,R,"Independent Movies, Thrillers",,,,,,,
s6591,Movie,Delirium,United States,9/1/2018,2018,R,"Horror Movies, Thrillers",,,,,,,
s6994,Movie,Hope Aur Hum,India,9/1/2018,2018,TV-14,"Children & Family Movies, Comedies, Dramas",,,,,,,
s7109,Movie,ìµœê°•ì „ì‚¬ ë¯¸ë‹ˆíŠ¹ê³µëŒ€ : ì˜ì›…ì˜ íƒ„ìƒ,,9/1/2018,2018,TV-Y7,Children & Family Movies,,,,,,,
s7528,Movie,Murder Party,United States,9/1/2018,2007,NR,"Comedies, Cult Movies, Horror Movies",,,,,,,
s7721,Movie,Pee Mak,Thailand,9/1/2018,2013,TV-MA,"Comedies, Horror Movies, International Movies",,,,,,,
s8051,Movie,Solo Con Tu Pareja,Mexico,9/1/2018,1991,NR,"Comedies, Independent Movies, International Movies",,,,,,,
s8090,Movie,Stephanie,United States,9/1/2018,2017,R,Horror Movies,,,,,,,
s8170,Movie,Terrifier,United States,9/1/2018,2017,TV-MA,"Horror Movies, Independent Movies, Thrillers",,,,,,,
s8376,Movie,The Keeping Hours,United States,9/1/2018,2017,PG-13,"Dramas, Thrillers",,,,,,,
s8451,Movie,The Perfect Day,,9/1/2018,2018,TV-14,"Documentaries, International Movies, Sports Movies",,,,,,,
s8490,Movie,The River Wild,United States,9/1/2018,1994,PG-13,Action & Adventure,,,,,,,
s8491,TV Show,The Road to Calvary,Russia,9/1/2018,2017,TV-14,"International TV Shows, TV Dramas",,,,,,,
s4663,TV Show,Monkey Twins,Thailand,9/2/2018,2018,TV-MA,"Crime TV Shows, International TV Shows, TV Action & Adventure",,,,,,,
s4664,TV Show,Quantico,United States,9/2/2018,2018,TV-14,"Crime TV Shows, TV Dramas, TV Mysteries",,,,,,,
s7428,Movie,Maynard,United States,9/2/2018,2017,TV-PG,Documentaries,,,,,,,
s4662,Movie,The Debt Collector,"United Kingdom, United States",9/3/2018,2018,TV-MA,Action & Adventure,,,,,,,
s6326,Movie,Black Panther,United States,9/4/2018,2018,PG-13,"Action & Adventure, Sci-Fi & Fantasy",,,,,,,
s7392,Movie,Man Up,"United Kingdom, France",9/4/2018,2015,R,"Comedies, International Movies, Romantic Movies",,,,,,,
s6194,Movie,ATM,"United States, Canada",9/5/2018,2012,TV-14,"Comedies, International Movies, Romantic Movies",,,,,,,
s6231,Movie,Bangkok Traffic (Love) Story,Thailand,9/5/2018,2009,TV-14,"Comedies, International Movies, Romantic Movies",,,,,,,
s7047,Movie,I Fine... Thank You... Love You,Thailand,9/5/2018,2014,TV-14,"Comedies, International Movies, Romantic Movies",,,,,,,
s7661,Movie,One Day,Thailand,9/5/2018,2016,TV-PG,"Dramas, International Movies, Romantic Movies",,,,,,,
s7738,Movie,Phobia 2,Thailand,9/5/2018,2009,TV-MA,"Horror Movies, International Movies",,,,,,,
s8014,Movie,Shutter,Thailand,9/5/2018,2004,TV-MA,"Horror Movies, International Movies",,,,,,,
s8114,Movie,Suckseed,Thailand,9/5/2018,2011,TV-MA,"Comedies, International Movies, Music & Musicals",,,,,,,
s4661,Movie,PK,India,9/6/2018,2014,TV-14,"Comedies, Dramas, International Movies",,,,,,,
s6955,Movie,Hell and Back,United States,9/6/2018,2015,R,"Action & Adventure, Comedies, Independent Movies",,,,,,,
s4654,Movie,City of Joy,"United States,",9/7/2018,2018,TV-MA,Documentaries,,,,,,,
s4655,TV Show,First and Last,,9/7/2018,2018,TV-MA,Docuseries,,,,,,,
s4656,TV Show,Marvel's Iron Fist,United States,9/7/2018,2018,TV-MA,"Crime TV Shows, TV Action & Adventure, TV Dramas",,,,,,,
s4657,Movie,Next Gen,"China, Canada, United States",9/7/2018,2018,TV-PG,"Children & Family Movies, Comedies, Sci-Fi & Fantasy",,,,,,,
s4658,Movie,Sierra Burgess Is A Loser,United States,9/7/2018,2018,PG-13,"Comedies, Romantic Movies",,,,,,,
s4659,TV Show,Stretch Armstrong & the Flex Fighters,United States,9/7/2018,2018,TV-Y7,Kids' TV,,,,,,,
s4660,Movie,The Most Assassinated Woman in the World,"Belgium, United Kingdom, United States",9/7/2018,2018,TV-MA,"Dramas, International Movies, Thrillers",,,,,,,
s6431,TV Show,Castle of Stars,,9/7/2018,2015,TV-MA,"International TV Shows, Romantic TV Shows, TV Comedies",,,,,,,
s7261,Movie,Laddaland,Thailand,9/7/2018,2011,TV-MA,"Horror Movies, International Movies",,,,,,,
s4652,TV Show,Transformers Prime,United States,9/8/2018,2013,TV-Y7,Kids' TV,,,,,,,
s4653,TV Show,Transformers: Robots in Disguise,United States,9/8/2018,2016,TV-Y7,Kids' TV,,,,,,,
s4651,TV Show,Show Me the Money,,9/9/2018,2004,TV-14,"International TV Shows, TV Comedies",,,,,,,
s4648,TV Show,Daniel Sloss: Live Shows,United States,9/11/2018,2018,TV-MA,"Stand-Up Comedy & Talk Shows, TV Comedies",,,,,,,
